	Segment ID	Source Segment	Segment Origin	Ref	Ref_rating	MT_Z	MT_Z_rating	MT_Y	MT_Y_rating
86	87	Pelosi announced an official impeachment investigation this week after Trump acknowledged he'd withheld military aid to Ukraine.	a	펠로시 의장은 트럼프 대통령이 우크라이나에 군사 지원을 요청했던 사실을 은폐했었다고 시인하자 이번 주에 공식적인 탄핵 조사를 발표했다.	3	펠로시는 트럼프가 우크라이나에 대한 군사 지원을 보류했다는 사실을 인정한 뒤 이번 주 공식 탄핵 조사를 발표했다.	2	펠로시는 이번 주 트럼프 대통령이 우크라이나에 대한 군사 지원을 유보했음을 인정하자 공식 탄핵 조사를 발표했다.	1
87	88	The aid was ultimately granted, but House Democrats want to know whether there was any connection to the aid and Trump's asking Zelensky to investigate Hunter Biden, who worked for a Ukrainian gas company for five years.	a	결과적으로 우크라이나의 지원은 받았었지만, 하원 민주당원들이 알고 싶어하는 것은 그 군사적 지원과 트럼프가 당시 5년간 한 우크라이나 가스 회사에서 근무 중이던 헌터 바이든에 대한 조사를 젤렌스키 대통령에게 의뢰한 사건 사이의 연관성이다.	1	지원금은 궁극적으로 부여됐지만 하원 민주당 의원들은 지원금과 관련이 있는지, 트럼프가 젤렌스키에게 우크라이나 가스회사에서 5년간 일했던 헌터 바이든을 조사해 달라고 부탁한 사실을 알고 싶어한다.	2	이번 지원은 결국 승인됐지만 하원 민주당 의원들은 원조와 관련이 있는지 알고 싶어하고 트럼프는 젤렌스키에게 우크라이나 가스회사에서 5년간 일한 헌터 바이든을 조사하라고 요청했다.	3
88	89	Also Friday, nearly 300 former U.S. foreign policy and national security officials signed a letter supporting the impeachment investigation.	a	또한 금요일에는 300명에 달하는 전직 미국 대외 정책 및 국가안보 관계자들이 탄핵 조사를 지지하는 서한에 서명했다.	3	또한 금요일에는 거의 300명의 전직 미국 외교 정책과 국가 안보 관리들이 탄핵 조사를 지지하는 서한에 서명했다.	2	또한 금요일 거의 300명의 전직 미국 외교정책 및 국가안보 관료들이 탄핵 조사를 지지하는 서한에 서명했다.	1
89	90	"The coalition said Trump's actions constitute a ""profound national security concern."""	a	"이 집단은 트럼프의 행위가 심각한 국가안보 문제""라고 말했다."	2	연립정부는 트럼프의 조치가 '국가 안보 우려'에 해당한다고 밝혔다.	1	"연합은 트럼프의 행동이 ""심각한 국가 안보 우려""라고 말했다."	2
90	91	We applaud those members of Congress, including Speaker Pelosi, who have started us down that necessary path, the letter states.	a	"이 서한에는 ""우리가 이 중요한 길을 걷을 수 있게 해준 펠로시 의장을 비롯한 하원의원들에게 찬사를 보낸다""라고 적혀 있다."	1	"서한에는 ""우리는 펠로시 의장을 포함한 의회 의원들에게 박수를 보낸다""고 적혀 있다."	2	"서한에는 ""우리는 펠로시 의장을 포함한 의회 의원들에게 박수를 보낸다""고 적혀 있다."	2
91	92	President Trump appears to have leveraged the authority and resources of the highest office in the land to invite additional foreign interference into our democratic process.	a	트럼프 대통령은 미국 최고 지위인 대통령으로써의 권력과 자원을 이용하여 우리나라의 민주적인 절차에 외세가 개입하게 했다.	2	트럼프 대통령은 이 땅 최고위직의 권한과 자원을 활용해 우리의 민주적 과정에 추가적인 외국인 간섭을 불러온 것으로 보인다.	1	트럼프 대통령은 이 땅에서 최고위직의 권위와 자원을 활용해 우리 민주주의 과정에 추가적인 외국의 간섭을 유도한 것으로 보인다.	1
92	93	That would constitute an unconscionable abuse of power.”	a	이는 몰지각한 권력 남용이다.”	1	"그건 비양심적인 권력 남용이 될 거야."""	2	"그것은 비양심적인 권력 남용이 될 것입니다."""	2
93	94	It would also represent an effort to subordinate America's national interests — and those of our closest allies and partners — to the president's personal political interest.	a	또한 이는 대통령 개인의 정치적 이익 때문에 미국의 (그리고 우리와 가장 가까운 동맹국들 및 파트너 국가들의) 국익을 경시하려는 행위이다.”	1	"""그것은 또한 미국의 국익, 그리고 우리의 가장 가까운 동맹국과 파트너들의 이익을 대통령의 개인적인 정치적 이익에 종속시키려는 노력을 나타낼 것이다."""	2	"""그것은 또한 미국의 국익, 그리고 우리의 가장 가까운 동맹국들과 파트너들의 이익을 대통령의 개인적 정치적 이익에 종속시키려는 노력을 의미할 것입니다."""	2
94	95	Trump has denied there was any impropriety with the phone call.	a	트럼프 대통령은 당시 전화통화에 부적절한 부분은 없었다며 부인했다.	1	트럼프는 전화에 부적합한 점이 없다고 부인했다.	3	트럼프는 이 전화에 어떠한 부적절함도 없다고 부인했다.	2
95	96	"Friday, he denounced the complainant and again said the call with Zelensky was a ""perfect conversation."""	a	그리고 금요일, 그는 이 신고서를 맹렬히 비판하면서 젤렌스키 대통령과 통화하며 “완벽한 대화”를 했다고 거듭 밝혔다.	3	"그는 금요일 이 불만자를 비난하고 젤렌스키와의 통화는 ""완벽한 대화""라고 말했다."""	2	"금요일, 그는 고소인을 비난하고 젤렌스키와의 통화는 ""완벽한 대화였다""고 다시 말했다."""	1
96	97	Sounding more and more like the so-called whistle-blower isn't a whistle-blower at all, he tweeted.	a	“소위 내부 고발자라는 자가 점점 더 내부 고발자가 전혀 아닌 것 같다”라고 그는 트위터에 올렸다.	1	"그는 트위터에 ""소위 내부고발자가 전혀 내부고발자가 아닌 것처럼 점점 더 많이 들린다""고 밝혔다."	3	"그는 트위터를 통해 ""점점 내부고발자처럼 들리는 것은 내부고발자가 아니다""라고 밝혔다."	2
97	98	In addition, all second-hand information that proved to be so inaccurate that there may not have been somebody else, a leaker or spy, feeding it to him or her?	a	“게다가 전부 간접적으로 얻은 그의 정보가 불명확한 것으로 드러나고 있어서 그/그녀에게 정보를 제공하는 기밀 누설자나 스파이가 배후에 있는 게 아닌가?	1	"""게다가 너무 부정확하다는 것이 증명된 모든 간접 정보, 누설자나 스파이가 그나 그녀에게 먹이를 주지 않았을지도 모르는 다른 사람이 있었을까?"	3	"""게다가, 너무 부정확한 것으로 판명된 모든 중고 정보는 유출자나 스파이가 그 사람에게 정보를 제공하는 것이 아니었을까요?"	2
98	99	A partisan operative?	a	혹은 정치 공작원?”	1	"당파적 공작원이라고요?"""	3	"당파 공작원?"""	2
99	100	Vice President Mike Pence also had interactions with Ukrainian leaders, the whistle-blower complaint shows, and he met with Zelensky in Poland earlier this month.	a	내부 고발자의 신고서에 따르면, 마이크 펜스 부통령도 우크라이나 지도자들과 교류가 있었으며 그가 이번 달 초에 폴란드에서 젤렌스키 대통령을 만났다.	1	마이크 펜스 부통령도 우크라이나 지도자들과 교류를 했고, 내부고발자 불만쇼에서는 이달 초 폴란드에서 젤렌스키를 만났다.	2	마이크 펜스 부통령은 내부고발자 고발 쇼인 우크라이나 지도자들과도 교류를 했으며 이달 초 폴란드에서 젤렌스키 대통령과 만났다.	2
100	101	He said neither Joe Biden or Hunter Biden were discussed.	a	조 바이든이나 헌터 바이든에 대한 논의는 없었다고 그는 말했다.	1	그는 조 바이든이나 헌터 바이든 둘 다 논의되지 않았다고 말했다.	2	그는 조 바이든이나 헌터 바이든 모두 논의되지 않았다고 말했다.	2
