	Segment ID	Source Segment	Segment Origin	Ref	Ref_rating	MT_Z	MT_Z_rating	MT_Y	MT_Y_rating
0	1	Man set alight on doorstep 'in targeted attack'	b	한 남성이 표적 범죄로 문 앞에서 불에 휩싸여	3	남자가 문간에 불을 붙였다. '목표 공격'	1	'목표된 공격'에 불을 지른 남자	2
1	2	A man has been set alight on his doorstep in what police believe is a targeted attack.	b	한 남성이 몸에 불이 붙은 채 문앞 계단에 놓여 있었다. 경찰은 표적 범죄에 가능성을 두고 있다.	2	한 남자가 경찰이 표적 공격이라고 믿는 곳에서 그의 문간에 불을 질렀다.	1	경찰이 표적 공격이라고 보고 있는 한 남자가 그의 집 앞에 불을 붙였다.	2
2	3	The 48-year-old was soaked in flammable liquid, believed to be petrol, before bursting into flames outside his home in Skelmersdale, West Lancashire.	b	48세의 이 피해자 남성은 미국 웨스트 랭커셔의 스켈머스데일에 위치한 자신의 집 밖에서 불길에 휩싸이기 직전에 몸에 휘발유로 추정되는 인화성 액체가 뒤덮여 있었다.	1	48세의 이 여성은 휘발유로 추정되는 가연성 액체에 흠뻑 젖은 뒤 웨스트 랭커셔 주 스켈머스데일에 있는 자신의 집 밖에서 불길에 휩싸였다.	2	48세의 노인은 웨스트 랭커셔의 스켈머스데일에 있는 자택 밖에서 불길에 휩싸이기 전에 휘발유로 추정되는 인화성 액체에 흠뻑 젖었다.	2
3	4	He is in hospital in a critical but stable condition after suffering serious burns.	b	이 남성은 심각한 화상을 입은 뒤 심각했지만 현재 안정된 상태로 병원에 입원 중이다.	2	그는 심각한 화상을 입은 후 위독하지만 안정된 상태로 병원에 입원해 있다.	1	그는 심각한 화상을 입은 후 위독하지만 안정된 상태로 병원에 있다.	1
4	5	Police have launched an attempted murder inquiry after they were called to the man's house at about 1am on Thursday.	b	경찰은 목요일 새벽 1시경 현장에 출동하였고, 해당 살인 미수 사건에 대한 조사에 착수했다.	1	경찰은 17일 새벽 1시경 이 남성의 집으로 불려간 뒤 살인미수 조사에 착수했다.	3	경찰은 목요일 오전 1시경 A씨의 집으로 출동한 후 살인 미수에 나섰다.	2
5	6	"Detective Chief Inspector Pauline Stables, leading the investigation, said: ""This is a horrific incident which has left a man in a very poorly condition in hospital."	b	수사를 진두지휘하고 있는 폴린 스테이블스 형사과장은 “한 사람을 그렇게 위험한 상태로 병원에 입원하게 만든 아주 끔찍한 사건이다”라고 말했다.	1	"수사를 주도하고 있는 폴린 스테이블스 형사과장은 ""이번 사건은 한 남성을 병원에 입원하게 한 끔찍한 사건이다."	2	"수사를 지휘하고 있는 폴린 스태블스 경감은 ""이것은 한 남성이 병원에 있는 상태가 매우 좋지 않은 끔찍한 사건이다."	3
6	7	We are carrying out a number of enquiries to try to identify those responsible.	b	우리는 범인을 찾기 위해 여러 조사를 진행하고 있다.”	2	"""우리는 책임자들을 확인하기 위해 여러 가지 조사를 하고 있다."	1	"""우리는 책임자를 파악하기 위해 여러 가지 조사를 수행하고 있습니다."	1
7	8	While we are trying to establish a motive for what has happened, we do believe that the incident was targeted and I would like to stress that I don't believe there is any threat to the wider community at this time.	b	“사건의 범행 동기를 찾으려고 노력 중이지만, 우리는 이번 사건을 표적 범죄로 보고 있고, 현재로서는 더 넓은 지역에까지 위험이 존재하지는 않을 것으로 본다”	2	"""우리가 일어난 일에 대한 동기를 확립하려고 노력하는 동안, 우리는 그 사건이 표적이 되었다고 믿고 있으며, 나는 이 시기에 더 넓은 지역사회에 어떠한 위협도 없다고 믿고 있다는 것을 강조하고 싶다."	1	"그는 ""우리는 이번 사건의 동기를 밝히기 위해 노력하고 있지만 이번 사건이 목표가 된 것으로 보고 있으며, 현재로서는 더 넓은 지역사회에 위협이 되지 않는다고 믿고 있다""고 강조했다."	2
8	9	Someone out there knows who has done this and I would urge them to come forward and speak to us.	b	“혹시 범인을 알고 있는 분은 우리에게 꼭 연락을 해주길 바란다”	1	"""저 밖에 있는 누군가가 누가 이런 짓을 했는지 알고 있고 나는 그들이 나서서 우리에게 말을 걸 것을 촉구할 것이다."	2	"""누가 이런 짓을 저질렀는지 아는 사람이 있을 것이고, 저는 그들이 나서서 우리에게 말하라고 촉구할 것입니다."	3
9	10	Has a loved one come home acting suspiciously, smelling of smoke or petrol or with unexplained injuries?	b	“사랑하는 사람이 집에 와서 수상한 행동을 하거나, 몸에서 담배나 기름 냄새가 난다든가, 없던 상처가 발견되는가?”	1	"""사랑하는 사람이 의심스럽게 행동하거나, 연기나 휘발유 냄새를 맡거나, 설명할 수 없는 부상을 입고 집에 오는가?"	2	"""사랑하는 사람이 연기나 휘발유 냄새를 맡거나 설명할 수 없는 부상을 입고 의심스러운 행동을 하면서 집에 왔나요?"	2
10	11	We need to find the people responsible for this dreadful crime.	b	“이런 끔찍한 범죄를 저지른 범인을 꼭 찾아야 한다.”	2	"""우리는 이 끔찍한 범죄에 책임이 있는 사람들을 찾아야 해."""	1	"""우리는 이 끔찍한 범죄에 책임이 있는 사람들을 찾아야 합니다."""	1
11	12	US deaths could result in Scottish ban on vaping and e-cigarette ads	a	미국 내 사망 사건의 여파로 스코틀랜드, 베이핑 및 전자담배 광고 금지해	2	미국의 죽음은 스코틀랜드의 vaping과 전자담배 광고 금지로 이어질 수 있다.	1	미국의 죽음은 스코틀랜드의 베이핑과 전자담배 광고 금지를 초래할 수 있다.	1
12	13	A BAN on advertising for e-cigarettes and vaping products, is being considered by ministers.	a	정부 부처에서 전자담배 및 베이핑에 대한 광고 금지를 고려하고 있다.	2	전자담배와 전자담배 제품 광고에 관한 BAN이 장관들에 의해 고려되고 있다.	3	장관들은 전자담배와 베이핑 제품에 대한 광고 금지를 고려하고 있다.	1
13	14	"The First Minister has confirmed that a consultation on the move would take place in ""the coming months."""	a	여당 대표는 해당 조치에 대한 논의가 “향후 수개월” 내에 진행될 것이라 밝혔다.	2	"초대 장관은 ""앞으로 몇 달 안에 이 같은 움직임에 대한 협의가 이뤄질 것""이라고 확인했다."""	2	"제1장관은 이 움직임에 대한 협의가 ""앞으로 몇 달 안에"" 이루어질 것이라고 확인했습니다."	1
14	15	"Nicola Sturgeon says that if evidence supports further moves over the sale of such products her Government would ""not hesitate"" to act."	a	니컬라 스터전 대표는 이 제품들의 판매 추이에 대한 정보가 입수되면 스코틀랜드 정부가 “망설임 없이” 행동할 것이라고 말했다.	1	니콜라 스터건은 만약 증거가 그러한 제품의 판매에 대한 추가적인 움직임을 뒷받침한다면, 그녀의 정부는 행동하기를 주저하지 않을 것이라고 말한다.	1	니콜라 스터전은 이러한 제품의 판매에 대한 추가적인 움직임을 뒷받침하는 증거가 있다면, 정부는 조치를 주저하지 않을 것이라고 말했습니다.	1
15	16	It comes as it emerged a vaping-related illness had claimed two more lives, bringing the total number of fatalities to 11.	a	이와 같은 조치는 베이핑 관련 질환으로 인한 사망자가 2명 추가 발생하여 총 11명의 사망자가 발생했기 때문이다.	1	그것은 한 vaping-related 질병이 두명의 생명을 더 요구했고, 총 사망자 수 11명을 가져왔다는 것이 밝혀진 가운데 나온 것이다.	2	이는 도배와 관련된 질병으로 2명이 더 사망하여 총 사망자가 11명으로 늘어났기 때문이다.	3
16	17	Vaping — which involves inhaling a mix typically made of nicotine, water, solvents and flavours — is seen as an alternative to smoking which can help you quit, but its safety is still not entirely known.	a	베이핑은 보통 니코틴, 물, 용제 및 향을 섞은 혼합물을 흡입하는 행위로, 금연을 도와주는 흡연 대체품으로 여겨지고 있으나 그 안전성이 완전히 확인되지는 않았다.	1	일반적으로 니코틴, 물, 용매 및 향료로 만든 혼합물을 흡입하는 것을 포함하는 진공은 담배를 끊는 데 도움이 될 수 있는 흡연의 대안으로 보여지지만, 그 안전성은 아직 완전히 알려져 있지 않다.	3	일반적으로 니코틴, 물, 솔벤트, 향료 등으로 이루어진 혼합물을 흡입하는 베이핑은 금연에 도움이 되는 흡연의 대안으로 여겨지지만, 그 안전성이 아직 완전히 알려진 것은 아니다.	2
17	18	But in the US, more than 500 people are known to have fallen ill with a mysterious lung disease after smoking e-cigarettes.	a	그러나 미국의 경우, 전자담배를 피운 후 원인을 알 수 없는 폐질환을 앓고 있는 사람의 수가 500명을 넘고 있다.	1	그러나 미국에서는 500명 이상의 사람들이 전자담배를 피운 후 신비한 폐질환으로 병에 걸린 것으로 알려져 있다.	2	그러나 미국에서는 500명 이상의 사람들이 전자담배를 피운 후 의문의 폐질환에 걸린 것으로 알려져 있다.	1
18	19	Officials said hundreds of additional cases had been reported in the past week alone.	a	미 당국에서는 지난주에만 수백 건의 추가 사례가 보고되었다고 말했다.	2	관계자들은 지난 한 주 동안만 수백 건의 추가 사례가 보고되었다고 말했다.	1	관계자들은 지난 주에만 수백 건의 추가 사례가 보고되었다고 말했다.	1
19	20	The first deaths in Florida and Georgia were announced on Tuesday and Wednesday.	a	지난 화요일과 수요일, 플로리다주와 조지아주에서 각각 최초 사망자가 발표되었다.	1	플로리다와 조지아에서 첫 사망자가 화요일과 수요일에 발표되었다.	2	플로리다와 조지아에서 발생한 첫 번째 사망자는 화요일과 수요일 발표되었습니다.	2
20	21	Currently 38 states have recorded cases of the illness, with lives lost in eight states.	a	현재 미국 내에서 발병 사례가 기록된 곳은 38개 주로, 그 중 8개 주에서 사망자가 발생했다.	1	현재 38개 주가 이 병의 사례를 기록했으며, 8개 주에서 사망자가 발생했다.	1	현재 38개 주에서 발병 사례가 기록되었으며 8개 주에서 사망자가 발생했다.	1
21	22	"While most patients have reported a history of using products containing THC, the psychoactive compound in cannabis, the patient who died in Georgia on Wednesday reported only ""heavy nicotine vaping."""	a	대부분의 환자들이 대마초에 들어 있는 향정신성 화합물인 THC가 함유된 제품을 사용한 이력이 있다고 밝혔으나, 지난 수요일 조지아주에서 사망한 환자의 경우에는 ‘과도한 니코틴 베이핑’ 이력만 보고되었다.	1	"대부분의 환자들이 대마초의 정신 활성 화합물인 THC가 함유된 제품을 사용한 전력을 보고한 반면, 조지아에서 사망한 환자는 수요일 ""무거운 니코틴 베핑""만을 보고했다."	3	대부분의 환자들이 대마초에 들어 있는 정신작용 화합물인 THC가 함유된 제품을 사용한 이력을 보고했지만 12일 조지아주에서 숨진 환자는 니코틴 베이핑이 심하다는 보고만 나왔다.	2
22	23	"The Centres for Disease Control and Prevention (CDC) has more than 100 officials investigating the cause of the mystery illness, and has warned citizens against smoking e-cigarette products until more is known, particularly if modified or bought ""off the street."""	a	미국 질병통제예방센터에서는 현재 100여 명의 담당자들이 정체불명의 이 질환의 원인을 조사하고 있으며, 시민들에게 더 많은 사실이 밝혀질 때까지 전자담배 제품, 특히 변형 제품이나 “길거리에서 구입한” 제품의 사용을 삼가라고 경고했다.	1	"질병통제예방센터(CDC)는 미스터리 질병의 원인을 조사하는 100명 이상의 관리를 두고 있으며, 특히 ""거리 밖에서"" 수정하거나 구입할 경우 더 많은 것이 알려질 때까지 전자담배 제품을 피우지 말라고 시민들에게 경고했다."	2	"질병통제예방센터(CDC)는 100명 이상의 관리들이 이 미스터리 질병의 원인을 조사하고 있으며, 특히 길거리에서 전자담배 제품을 개조하거나 구입하는 경우 더 많이 알려지기 전까지는 국민들에게 전자담배 제품을 피우지 말라고 경고했다."""	1
23	24	"The First Minister has confirmed the Scottish Government was monitoring developments in the US and elsewhere ""closely,"" following the loss of life that has been attributed to vaping."	a	여당 대표는 베이핑 관련 사망 사고 이후 스코틀랜드 정부가 미국 및 타국의 진행 상황을 “면밀히” 모니터링하고 있다고 밝혔다.	1	"초대 장관은 스코틀랜드 정부가 도박으로 인한 인명 손실에 이어 미국 등지의 발전을 ""밀밀히"" 감시하고 있다는 것을 확인했다."	3	스코틀랜드 정부는 베이핑으로 인한 인명 피해에 이어 미국과 그 밖의 다른 지역의 상황들을 면밀히 감시하고 있다고 제1장관은 확인했다.	2
24	25	She pointed out that to date they have not seen any cases of deaths attributed to vaping being reported in Europe.	a	그녀는 유럽 내에서는 아직까지 베이핑으로 인한 사망 사건은 보고된 바 없다는 사실을 지적했다.	1	그녀는 지금까지 유럽에서 vaping이 보고된 것으로 인한 사망 사례를 보지 못했다고 지적했다.	3	그녀는 현재까지 유럽에서 베이핑으로 인한 사망 사례가 보고되지 않고 있다고 지적했다.	2
25	26	Our approach has been a precautionary one, which is why in Scotland we have already taken the strictest regulatory approach in Europe to vapour products, she said.	a	"우리의 접근 방식은 미연의 방지하는 것이고, 그게 바로 스코틀랜드가 이전부터 유럽에서 베이퍼를 가장 엄격하게 규제하고 있는 이유이다""라고 그녀는 말했다."	1	"""우리의 접근방식은 예방책이었고, 그래서 스코틀랜드에서 우리는 이미 유럽에서 제품을 증기화하기 위해 가장 엄격한 규제 접근법을 취했다""고 그녀는 말했다."	3	"그는 ""우리의 접근방식은 예방적인 것이었으며, 이것이 스코틀랜드가 이미 유럽에서 가장 엄격한 증기제품 규제 방식을 채택한 이유""라고 말했다."	2
26	27	The European tobacco products directive restricts the advertising of e-cigarettes and ensures that e-liquids cannot contain ingredients that are known to be harmful.”	a	담배에 대한 유럽의 지침에 따르면, 전자담배 광고가 제한되어 있고, 액상 전자담배에 유해성이 알려진 성분을 첨가할 수 없다.”	2	"""유럽 담배 제품 지침은 전자담배의 광고를 제한하고 전자 액체가 해로운 것으로 알려진 성분을 함유할 수 없도록 한다."""	1	"""유럽 담배 제품 지침은 전자담배의 광고를 제한하고 전자액체가 유해하다고 알려진 성분을 함유하지 못하도록 하고 있습니다."""	1
27	28	The directive also limits the concentration of nicotine in e-liquids.”	a	“또한, 이에 따르면 액상 전자담배 내 니코틴 농도도 제한되어 있다.”	2	"""이 지침은 또한 e-liquids에서 니코틴의 농도를 제한한다."""	2	"""이 지침은 또한 전자 액체의 니코틴 농도를 제한합니다."""	1
28	29	In Scotland, we have also introduced a retail register and a mandatory age verification scheme and we have funded trading standards departments in all council areas to ensure that retailers comply with the regulations.”	a	“우리 스코틀랜드는 소매 등록 제도 및 의무적 나이 인증 제도를 도입했으며, 모든 의회 구역 내 위치한 거래 규정을 관리하는 부서들을 재정적으로 지원하여 소매점들이 규정을 준수하는지 관리하고 있다.”	1	"""스코틀랜드에서는 소매 등록부와 의무 연령 확인 제도를 도입했으며 소매상들이 규정을 준수하도록 하기 위해 모든 의회 지역의 무역 표준 부서에 자금을 지원했다."""	1	"그는 ""스코틀랜드에서는 소매업 등록부와 의무 연령 확인 제도를 도입했으며 소매업자들이 규정을 준수할 수 있도록 모든 지역의 거래 기준 부서에 자금을 지원했다""고 덧붙였다."	2
29	30	"In the coming months, we will consult on introducing a complete ban on the advertising and promotion of vapour products."""	a	“향후 수개월간 우리는 베이퍼의 광고 및 판촉 활동에 대한 전면 금지 조치를 도입하는 문제에 대해 논의할 예정이다.”	1	"""앞으로 몇 달 안에 증기제품의 광고와 홍보에 대한 완전한 금지를 도입하는 것에 대해 협의할 것이다."""	2	"""앞으로 몇 달 안에 증기 제품의 광고와 홍보를 전면 금지하는 방안을 협의할 것입니다."""	2
30	31	"She added: ""It is important to stress, and for all of us to remember, that those devices are relatively new and, therefore, their impact continues to be studied."	a	그녀는 또한 이렇게 말했다. “이러한 제품들이 비교적 처음이고, 그렇기 때문에 그 영향에 대해 지속적인 연구가 필요하다는 사실을 강조하고 우리 모두가 이를 기억해야 한다.	1	"그는 ""이 장치들이 비교적 새롭고 따라서 그들의 영향이 계속 연구되고 있다는 것을 우리 모두가 기억하는 것이 중요하다""고 덧붙였다."	2	"그는 이어 ""우리 모두가 기억해야 할 중요한 것은 이 장치들이 상대적으로 새로운 것이어서 그 영향이 계속 연구되고 있다는 것이다""고 덧붙였다."	2
31	32	We do not yet fully understand what that impact is, which is why the approach that we have taken has been very cautious.”	a	우리는 아직 그것이 어떤 영향을 주는지 완전히 이해하지 못하고 있으며, 그렇기 때문에 우리가 이 문제에 매우 신중하게 접근하고 있는 것이다.”	1	"우리는 아직 그 영향이 무엇인지 완전히 이해하지 못하기 때문에 우리가 취한 접근법이 매우 신중한 이유입니다. """	2	그 영향이 무엇인지 아직 완전히 이해하지 못했기 때문에 우리가 취한 접근방식은 매우 조심스러웠다고 말했다.	1
32	33	That is perhaps a reason why e-cigarette use remains relatively low in Scotland.”	a	“그것이 아마도 스코틀랜드 국내에서 전자담배 사용률이 비교적 낮은 이유일 것이다.”	1	"""그것이 아마도 스코틀랜드에서 전자담배 사용이 상대적으로 낮은 이유일 것이다."""	1	"""그것이 아마도 스코틀랜드에서 전자담배 사용이 상대적으로 낮은 이유일 것입니다."""	1
33	34	We remain committed to following the best evidence to take any steps necessary to ensure that people are protected from potential harm.”	a	“우리는 국민들을 잠재적 위험으로부터 보호하기 위해 필요한 모든 조치를 취하는 데 가장 타당한 증거를 찾고자 최선을 다할 것이다.	2	"""우리는 사람들이 잠재적인 해악으로부터 보호받을 수 있도록 필요한 조치를 취하기 위해 최선의 증거를 따르는데 전념하고 있다."""	1	"""우리는 사람들이 잠재적 피해로부터 보호받을 수 있도록 필요한 조치를 취하기 위해 최선의 증거를 따르는데 전념하고 있습니다."""	1
34	35	While we already have among the strictest regimes on those products, if the evidence shows that further action is needed... we will not hesitate to take it.	a	"“우리가 이미 해당 제품들에 대해 가장 엄격한 규제를 실시하고 있지만, 추가적인 조치가 필요하다는 증거가 확인될 경우... 망설임 없이 해당 조치를 취할 것이다""라고 말했다."	1	"""우리는 이미 그 제품들에 대한 가장 엄격한 정권들 중 하나이지만, 만약 그 증거가 더 이상의 조치가 필요하다는 것을 보여준다면... 우리는 그것을 주저하지 않을 것이다."""	2	"""이미 이러한 제품에 대해 가장 엄격한 방법을 사용하고 있지만, 그 증거가 추가 조치가 필요하다는 것을 보여준다면... 주저하지 않고 받아들이겠습니다."""	1
35	36	The Next Big Labor Strike Hits Oregon	b	오리건주 강타한 대규모 노동자 파업	2	다음 번 대규모 노동 파업이 오리건 주를 강타하다	1	오리건주, 대규모 노동파업 발생	2
36	37	"The state university workers"" most pressing complaints center on low wages and a lack of dignity at work."	b	이 주립대학교 직원들의 가장 큰 불만은 저임금과 일터에서의 존엄성 부재 문제이다.	2	"주립대 근로자들""가장 긴급한 불만은 낮은 임금과 직장에서의 존엄성 부족에 초점을 맞추고 있다."	1	"""주립 대학 노동자들""이 가장 압박하는 불만사항은 낮은 임금과 직장에서의 품위 부족에 집중되어 있다."	3
37	38	The pay disparities alone are shocking. 	b	임금 격차만 놓고 봐도 충격적이다.	1	임금 격차만 해도 충격적이다.	1	임금 격차만으로도 충격적이다.	1
38	39	About half of these workers earn less than $40,000 per year (and hundreds make less than $25,000). 	b	이들 중 절반 가량은 연봉이 4만 달러 조차 되지 않는다. (그리고 몇 백 명은 25,000달러도 안 된다.)	2	이들 근로자의 약 절반은 연간 4만 달러 미만의 수입을 올리고 있다(그리고 수백 명은 2만 5천 달러 미만을 번다).	1	이들 근로자의 절반 가량은 연간 4만 달러 이하(수백 명이 2만 5천 달러 이하)를 벌고 있다.	1
39	40	"Meanwhile, university presidents"" annual salaries average out to $500,000 and four university athletics coaches are pulling down a cool $1 million. "	b	반면 대학 총장의 연봉은 평균 50만 달러이며 4명의 대학교 선수 코치의 경우는 백만 달러를 훌쩍 넘는다.	1	한편, 대학 총장들의 연봉은 평균 50만 달러, 대학 육상 코치 4명은 100만 달러를 절감하고 있다.	2	한편, 대학 총장들의 연봉은 평균 50만 달러에 달하며, 4명의 대학 체육 코치들이 100만 달러를 끌어내리고 있다.	2
40	41	While school administrators enjoy six-figure salaries and overall administrative spending continues to bloat, one in six classified staffers qualify for food stamps.	b	대학 행정 직원들이 여섯 자리의 연봉을 누리고 전체 행정 지출은 계속 불어남에도 계약직 교직원 6명 중 1명만 식권을 지원 받는다.	1	학교 행정가들은 6자리의 급여를 받고 전반적인 행정 지출은 계속 늘어나고 있지만, 6명의 기밀 직원 중 1명은 식권 자격을 얻는다.	2	학교 관리자들이 6자리의 급여를 받고 전체 행정 지출이 계속 증가하고 있는 반면, 6명의 기밀 직원 중 1명은 식권을 받을 자격이 있다.	2
41	42	"As Alejandro Segurra, another IT worker at Portland State University, said, ""I'm willing to go on strike because I don't think it's fair that people are paid wages that don't allow them to live in the city that they serve."""	b	포틀랜드주립대학교의 IT 직원인 알레한드로 세구라는 “나는 기꺼이 파업할 것이다. 왜냐하면 내가 근무하는 도시에 살 수 없을 정도의 임금을 받는 것은 부당하다고 생각하기 때문이다.”라고 말했다.	1	"포틀랜드 주립대학의 또 다른 IT 직원인 알레한드로 세구라는 ""사람들이 그들이 봉사하는 도시에서 살 수 없는 임금을 받는 것은 공평하지 않다고 생각하기 때문에 파업에 가겠다""고 말했다."	2	"Portland State University의 또 다른 IT 직원인 Alejandro Segurra는 ""사람들이 봉사하는 도시에 거주할 수 없는 임금을 받는 것은 부당하다고 생각하기 때문에 기꺼이 파업에 돌입할 용의가 있다""고 말했다."	2
42	43	"Portland State library worker Theresa Stapleburg was even more direct: ""I want to strike because I've been here 24 years, and I need a raise - a living wage."""	b	포틀랜드주립도서관의 직원인 테레사 스테이플버그는 더 직설적으로 표현했다. “내가 파업하려는 이유는 내가 여기에서 24년간 근무했고, 나는 연봉 인상이 필요하기 때문이다. 생존에 필요한 돈이다.”	1	"포틀랜드 주립 도서관 직원 테레사 스테이플버그는 ""24년 동안 이곳에 있었기 때문에 파업을 하고 싶다""고 말했다."	2	"포틀랜드 주립 도서관 직원인 테리사 스테이플버그는 ""24년 동안 근무해 왔기 때문에 파업을 하고 싶다""며 ""생계급여를 인상해야 한다""고 말했다."""	1
