	Segment ID	Source Segment	Segment Origin	Ref	Ref_rating	MT_Z	MT_Z_rating	MT_Y	MT_Y_rating
43	44	As inflation climbs and the cost of living in Oregon soars, these workers are being left to flounder, and management has shown little sympathy for their plight. 	b	극심한 인플레이션과 오리건 주의 높은 물가 때문에 이 직원들이 곤경에 처해 있지만, 경영진들은 이들의 처지에 일말의 동정심도 보이지 않고 있다.	1	인플레이션이 상승하고 오리건 주 생활비가 치솟으면서 이들 근로자들은 허둥지둥 방치되고 있으며 경영진은 그들의 곤경에 대해 거의 동정심을 보이지 않고 있다.	2	인플레이션이 상승하고 오리건주 생활비가 치솟으면서 이들 노동자들은 곤혹스러운 상황에 대해 경영진은 별다른 공감을 보이지 않고 있다.	2
44	45	Contract negotiations that began in February broke down in mid-August. 	b	2월에 시작된 임금 협상은 8월 중순에 결렬되었다.	1	지난 2월부터 시작된 계약 협상은 8월 중순 결렬됐다.	1	지난 2월 시작된 계약 협상이 8월 중순 결렬됐다.	1
45	46	At that point, the bosses had laid out some particularly egregious proposals - a paltry cost-of-living increase, a denial of seniority demands from long-term university workers, and a price hike for staff meals - that workers saw as disrespectful, and even cruel.	b	당시 윗선에서는 쥐꼬리만한 생활비 인상이나 대학교 장기 근속 직원의 연공 서열 요구 거부, 직원 식비 인상 등 매우 터무니없는 제안을 했고, 직원들은 이를 무례하고 심지어 잔인하다고까지 여겼다.	1	그 시점에서 상사들은 특히 터무니없는 제안들, 즉 보잘것없는 생활비 인상, 장기 대학 노동자들의 연공서열 요구 거부, 그리고 직원들의 식사 가격 인상 등 근로자들이 무례하고 심지어 잔인하다고 본 몇 가지를 제시했었다.	1	그 시점에, 사장들은 노동자들이 무례하고 심지어 잔인하다고 보는 사소한 생계비 인상, 대학 장기 노동자들의 연공서열 요구 거부, 그리고 직원 급식에 대한 가격 인상 등 특히 터무니없는 제안들을 내놓았다.	2
46	47	There is an unwritten class system at the universities, Fulmer said. 	b	펄머 씨는 “대학교에서는 보이지 않는 계급이 존재한다.”라고 말했다.	1	"풀머 교수는 ""대학에는 불문율 수업제도가 있다""고 말했다."	2	대학에는 불문율 수업 제도가 있다고 풀머는 말했다.	2
47	48	And we are at the bottom of it.	b	“거기서 우리가 제일 밑바닥이다.”	1	"""그리고 우리는 그 밑바닥에 있다."""	1	"""그리고 우리는 그 밑바닥에 있습니다."""	1
48	49	Education workers have been under attack for decades, he continued. 	b	그는 “교육계 종사자들은 수십 년간 피해를 입었다.”라고 말하며,	2	"그는 이어 ""교육 종사자들은 수십 년 동안 공격을 받아왔다""고 덧붙였다."	1	"그는 ""교육 노동자들은 수십 년 동안 공격을 받아왔다""고 덧붙였다."	2
49	50	We are finally standing up and fighting back.	b	“이제 우리가 드디어 일어나서 반격에 나서게 되었다.	2	"""우리는 마침내 일어서서 반격하고 있다."	1	"""우리는 마침내 일어서서 맞서고 있습니다."	1
50	51	It's one thing to see classism and the squeezing of the middle class in the corporate world as executives see their relatively obscene pay continue to go up at rates above inflation. 	b	보통 기업에서 중산층을 계급적으로 차별하고 압박하는 반면 경영진들은 다른 사람에 비해 터무니없이 높은 연봉을 받으며 인플레이션보다 높은 비율로 연봉을 계속 불리는데, 그건 그거다.	2	경영진들이 상대적으로 음란한 급여가 인플레이션보다 높은 비율로 계속 오르고 있다고 보고 있기 때문에, 계급주의와 기업계의 중산층의 압박을 보는 것은 한 가지 일이다.	3	경영진이 상대적으로 터무니없는 급여가 인플레이션보다 계속 오르고 있는 것을 보고 있기 때문에 기업 세계에서 계급주의와 중산층의 압박이 나타나는 것은 한 가지이다.	1
51	52	But for the same thing to be happening in education is not something workers will continue to tolerate.	b	이런 유사한 일이 교육계에서 벌어지는 걸 우리가 계속 용인할 수는 없을 것이다.”	2	"그러나 교육에서도 같은 일이 일어나는 것은 노동자들이 계속 용인할 일이 아니다."""	1	"그러나 같은 일이 교육에서 일어나는 것은 노동자들이 계속 용납할 일이 아니다."""	1
52	53	And Oregon's state university workers aren't the only ones taking action.	b	물론 오리건주립대학교 직원들만 파업에 나선 건 아니다.	2	그리고 오레곤의 주립대학 근로자들만이 조치를 취하는 것은 아니다.	1	오리건 주립대학 직원들만이 조치를 취하는 것은 아니다.	2
53	54	Oregon is a powder keg of militancy right now, and its fuse is now burning bright and hot.	b	오리건은 현재 교전 직전 상태의 화약고나 다름없으며, 그 도화선은 밝고 뜨겁게 타오르고 있다.	1	오레곤은 지금 호전성의 분말통이며, 그 퓨즈는 현재 밝고 뜨겁게 타오르고 있다.	2	오레곤은 지금 전투의 화약고고고 퓨즈는 밝고 뜨겁게 타오르고 있습니다	3
54	55	Grocery store workers at the Fred Meyer supermarket chain are ramping up their campaign against their employer, and while there are no official plans to strike yet, tensions are running high; their union, United Food and Commercial Workers Local 555, has already called for a boycott, and filed an unfair labor practice report against the chain.	b	대형마트 체인인 프레드 메이어의 직원들도 고용주를 상대로 캠페인을 벌이고 있으며, 아직 공식적인 파업 계획은 없지만 긴장이 고조되고 있다. 이곳의 노동조합인 연합 식품 및 상업 노동자 555 지부는 이미 보이콧에 돌입했고 해당 체인을 상대로 불공정 노동 관행 보고서를 제출했다.	2	프레드 마이어 슈퍼마켓 체인의 식료품점 근로자들은 고용주에 대한 캠페인을 강화하고 있으며, 아직 파업할 공식적인 계획은 없지만 긴장이 고조되고 있다; 그들의 노조인 유나이티드 푸드 앤 상업 노동자 지역 555는 이미 보이콧을 요구했고, 체인에 대해 불공정한 노동 관행 보고서를 제출했다.	1	프레드 마이어 슈퍼마켓 체인의 식료품점 노동자들은 고용주에 대한 반대 운동을 강화하고 있으며 아직 파업 계획은 없지만 긴장이 고조되고 있다. 그들의 노조인 '연합식품상업노동자 555'는 이미 보이콧을 요구했으며 체인에 대한 부당한 노동 관행 보고서를 제출했다.	2
55	56	In the healthcare sector, the 4,500 members of the Service Employees International Union Local 49 workers at Kaiser Permanente authorized a strike (with a 98 percent approval rate) if a deal isn't reached before their existing contract expires in October - which was only narrowly avoided with a new tentative agreement. 	b	의료계에서는 카이저 퍼머넌트의 노조인 서비스종업원 국제연맹49 지부의 회원 4,500명이 기존의 계약이 10월 만료되기 전까지 협상이 타결되지 않을 경우 파업하는 것을 (찬성 98%로) 승인했었다. 그러나 새 임시 합의가 체결되며 가까스로 이 상황을 피할 수 있었다.	1	의료 분야에서는 카이저 퍼머넌트의 4,500명의 서비스 직원 국제 연합 지역 49명의 근로자들이 10월에 기존 계약이 만료되기 전에 협상이 타결되지 않을 경우 파업(98%의 승인률로)을 승인했는데, 이는 새로운 잠정적인 합의로 간신히 피했다.	1	의료 분야에서는, 카이저 퍼머넌트의 4,500명의 국제노동조합(ISU) 회원들이 10월에 기존 계약이 만료되기 전에 협상이 타결되지 않으면 파업을 허가했다. 그러나 새로운 잠정 합의로 가까스로 피할 수 있었다.	2
56	57	Elsewhere in the industry, the Oregon Nurses Association, which represents more than 120 nurses at Astoria Hospital, has been deadlocked in contract negotiations with the hospital administration; their last contract expired in May, and the clock is ticking.	b	다른 지역의 동종 업계에서는 아스토리아 병원의 간호사 120명 이상을 대변하는 오리건간호사협회와 병원 경영진 간의 계약 협상이 교착상태에 빠졌다. 이들의 최종 계약은 5월에 만료되어 시간이 얼마 남지 않았다.	1	업계 다른 곳에서는 아스토리아 병원의 120명 이상의 간호사를 대표하는 오레곤 간호사 협회가 병원 행정부와의 계약 협상에서 교착 상태에 빠져 있습니다. 그들의 마지막 계약은 5월에 만료되었고 시계는 똑딱거리고 있다.	2	아스토리아 병원의 120명 이상의 간호사를 대표하는 오리건 간호사 협회는 지난 5월 마지막 계약이 만료되면서 병원 관리청과의 계약 협상에 교착 상태에 빠졌다.	3
57	58	Oregon has a really strong labor movement that is really building from the ground up, Burley explains. 	b	“오리건에서 정말 강력한 노동운동이 사회 밑바닥에서부터 차근차근 기반을 다지고 있다. “라고 벌리 씨는 설명했다.	2	"벌리는 ""오레곤은 정말 강력한 노동운동을 하고 있다""고 설명했다."	1	"벌리는 ""오레곤은 정말 원점에서부터 건설되고 있는 강력한 노동운동을 하고 있다""고 설명한다."	2
58	59	This is a part of the national wave of labor growth. 	b	이는 국지적으로 나타나는 노동력 증가 추세의 일환이다.	1	"""이것은 노동성장의 국가적 물결의 일부분이다."	1	"""이는 노동 성장의 국가적 물결의 한 부분입니다."	1
59	60	People are seeing a precarious economy where real wages are falling and the solution is collective action in the workplace.	b	사람들은 실질 임금이 하락하는 위태로운 경제 상황을 목격하고 있다. 이에 대한 해결책은 일터에서 집단적으로 행동하는 것이다.”	1	실질임금이 떨어지고, 해결책이 직장 내 집단행동인 불안정한 경제를 보고 있다고 말했다.	2	"국민들은 실질 임금이 떨어지고 있고 해결책은 직장 내 집단행동인 위태로운 경제를 보고 있다."""	2
60	61	It's unclear just how deeply such collective action may take root this fall, but it certainly would be fitting if the general strike returned to the Northwest in 2019. 	b	이런 집단 행동이 올 가을에 얼마나 깊게 뿌리 내릴지는 알 수 없으나, 총파업이 2019년 북서부 수준으로 복귀한다면 제대로 자리잡을 수 있을 것이다.	1	올 가을 이런 집단행동이 얼마나 깊이 뿌리내릴지는 분명치 않지만, 2019년 총파업이 북서부로 복귀한다면 확실히 적합할 것이다.	2	이런 집단행동이 올가을 얼마나 뿌리 깊게 뿌리내릴지는 미지수지만 2019년 총파업이 북서쪽으로 돌아간다면 적격일 것이다.	2
61	62	And from there we can only hope that its spirit will spread even further, into the heart of Midwestern farming, Southern manufacturing, Texan oil fields, Appalachian coal mines, Northeastern construction, the Silicon Valley tech giants, and everywhere in between. 	b	이를 시작으로 우리는 그 정신이 더욱더 확산되길 기대할 수 있다. 중서부 농업 중심지와 남부 제조업 지대, 텍사스 유전 지대, 애팔라치아 탄광 지대, 북동부 건설 지대, 실리콘밸리의 첨단 거대기업 지구 및 그 사이에 존재하는 모든 지역까지 말이다.	1	그리고 거기서부터 우리는 그 정신이 중서부 농업, 남부 제조업, 텍사스 유전, 애팔래치아 탄광, 북동부 건설, 실리콘 밸리 기술 대기업, 그리고 그 사이에 있는 모든 곳의 심장부로 더 확산되기를 바랄 뿐이다.	1	그리고 거기서부터 우리는 그 정신이 더욱 확산되기를 바랄 뿐입니다 중서부 농업, 남부 제조업, 텍사스 유전, 애팔래치아 탄광, 북동부 건설, 실리콘 밸리 기술 대기업, 그리고 그 사이의 모든 곳.	2
62	63	Lord knows that something's gotta give.	b	신은 어떤 건 줘야 한다는 걸 알고 있다.	2	신은 뭔가가 줄 수 있다는 걸 아신다.	1	뭔가 주는 게 있다는 걸 주님은 알고 계시지	2
63	64	School strikers around the world march to demand action on climate	a	전세계 기후 학교 파업 시위자들, 기후 행동 요구하며 행진해	2	전 세계 학교 파업자들이 기후에 대한 조치를 요구하기 위해 행진하고 있다.	1	전 세계의 학교 파업자들이 기후에 대한 조치를 요구하기 위해 행진한다.	1
64	65	Children around the world launched another wave of school strikes demanding action on climate change Friday, in their first major action since the issue topped world leader's agenda at the United Nations this week.	a	전세계 어린이들이 기후 변화에 대한 행동을 촉구하기 위해 학교 파업의 물결을 다시 시작했다. 이는 이번 이슈가 이번 주 UN에 모인 세계 정상들의 핵심 어젠다로 부상한 이래 펼쳐진 그들의 첫 주요 행보이다.	2	전 세계 어린이들이 이번 주 유엔에서 이 문제가 세계 지도자의 의제를 상회한 이후 처음으로 기후변화에 대한 조치를 요구하는 또 다른 학교 파업에 돌입했다.	2	전 세계 어린이들이 금요일 기후변화에 대한 조치를 요구하는 또 다른 파업에 돌입했는데, 이는 이번 주 유엔에서 기후변화가 세계 지도자의 의제에서 1위를 차지한 이후 첫 번째 주요 조치였다.	1
65	66	The Fridays for Future movement that began as a lone demonstration by Swedish teen Greta Thunberg just over a year ago has mushroomed, with millions of students taking to the streets of cities like New York and attracting attention in developing nations across Africa.	a	바로 1년 전 그레타 툰베리라는 한 스웨덴의 십대 소녀의 1인 시위로 시작된 미래를 위한 금요일 운동이 우후죽순 번져, 수백만 명의 학생들이 뉴욕같은 대도시의 거리를 점령했고 아프리카의 여러 개발도상국가들이 주목하고 있다.	1	1년 전 스웨덴의 10대 그레타 툰버그의 단독 시위로 시작된 미래 운동을 위한 금요일은 수백만 명의 학생들이 뉴욕과 같은 도시 거리로 나와 아프리카 전역의 개발도상국에서 관심을 끌고 있는 등 급증했다.	2	불과 1년 전 스웨덴의 10대 그레타 툰버그가 단독 시위를 벌이면서 시작된 '미래의 금요일' 운동은 수백만 명의 학생들이 뉴욕과 같은 도시의 거리로 나와 아프리카 전역의 개발도상국에서 관심을 모으고 있다.	1
66	67	Some of the first protests began in New Zealand, where Thunberg said organizers estimated 170,000 people marched across the country.	a	뉴질랜드에서 최초의 시위가 시작되었는데, 툰베리에 따르면 17만 명으로 추산되는 인파가 뉴질랜드를 행진했다.	2	첫 번째 시위 중 일부는 뉴질랜드에서 시작되었는데, 툰버그는 주최측이 17만 명의 사람들이 전국을 행진했다고 말했다.	1	첫 번째 시위 중 일부는 뉴질랜드에서 시작되었는데, 툰버그는 주최측이 17만 명이 전국을 행진했다고 말했다.	1
67	68	There were also marches in cities in Italy, Finland, Nigeria, Austria and India, among other countries.	a	또한 이탈리아, 핀란드, 나이지리아, 오스트리아, 인도를 위시한 많은 나라에서 행진이 이어졌다.	2	이탈리아, 핀란드, 나이지리아, 오스트리아, 인도의 도시에서도 행진이 있었습니다.	1	이탈리아, 핀란드, 나이지리아, 오스트리아, 인도 등에서도 행진이 있었다.	2
68	69	Friday's protest followed a week of climate talks at the United Nations in New York, which included a scathing speech by Thunberg to world leaders reprimanding them for inaction.	a	금요일에 벌어진 시위는 뉴욕에 위치한 UN에서 개최된 일주일간의 기후 회의에서 행동하지 않는 세계 정상들 향하여 신랄하게 비판한 툰베리의 연설이 있은 뒤였다.	2	금요일의 시위는 뉴욕의 유엔에서 일주일간의 기후 회담에 이은 것으로, 툰버그가 세계 지도자들에게 무반응을 이유로 그들을 비난하는 신랄한 연설을 포함했다.	1	금요일 뉴욕 유엔에서 기후회담이 일주일 동안 열린 데 이어, 툰버그는 세계 지도자들에게 자신들의 행동을 질책하는 통렬한 연설을 했다.	2
69	70	You have stolen my dreams and my childhood with your empty words, she said on Tuesday.	a	"툰베리는 “당신들은 의미없는 말들로 나의 꿈과 어린 시절을 빼앗아 갔다""라고 화요일 밝혔다."	2	"그녀는 20일 ""당신은 공허한 말로 내 꿈과 어린 시절을 훔쳤다""고 말했다."	3	"""당신은 당신의 공허한 말로 나의 꿈과 어린 시절을 훔쳤습니다,""라고 그녀는 화요일에 말했다."	1
70	71	The eyes of all future generations are upon you and if you choose to fail us, I say we will never forgive you.	a	“미래 세대가 모두 당신을 주시하고 있다. 만약 우리를 실망시킬 선택을 한다면 난 이 자리에서 우리가 절대 당신을 용서하지 않을 거라고 말할 것이다.”	1	모든 미래 세대의 눈이 당신에게 달려 있고 만약 당신이 우리를 실패하기로 선택한다면, 나는 우리가 결코 당신을 용서하지 않을 것이라고 말한다.	2	모든 후세의 시선이 당신을 주시하고 있는데, 만약 당신이 우리를 실망시키기로 선택한다면, 우리는 당신을 절대 용서하지 않을 것입니다.	1
71	72	Citing a U.N.-backed report released last year, demonstrators are demanding governments implement measures to prevent global temperatures from rising more than 2.7 degrees, which scientists warn result in dire consequences for human life and the planet.	a	지난해 공개된 UN 후원 보고서에 따르면, 시위자들은 지구 온도가 2.7도 이상 상승하지 않도록 정부가 적절한 조치를 취해야 한다고 요구하고 있다. 그렇지 않으면 인간의 삶과 지구 전체에 재앙을 초래할 결과를 초래한다고 과학자들은 말한다.	1	시위대는 지난해 발표된 유엔의 지원을 받는 보고서를 인용해 지구 기온이 2.7도 이상 오르는 것을 막기 위한 조치를 시행할 것을 정부에 요구하고 있는데, 과학자들은 이를 통해 인간과 지구에 심각한 결과를 초래할 것이라고 경고하고 있다.	2	시위대는 지난해 유엔이 지지한 보고서를 인용, 지구온도가 2.7도 이상 상승하는 것을 막기 위한 조치들을 정부에 요구하고 있으며, 이는 인류와 지구에 심각한 결과를 초래할 것이라고 과학자들은 경고하고 있다.	2
72	73	Thunberg and the young people she has inspired say they will not stop their weekly classroom walkouts until they see a reduction in greenhouse gas emissions responsible for climate change.	a	툰베리와 그녀의 영향을 받은 학생들은 기후 변화의 원인인 온실가스 배출량이 감소되기 전까지 매주 학교 수업을 거부할 것이라고 밝혔다.	1	툰버그와 그녀가 영감을 준 젊은이들은 기후변화에 책임이 있는 온실가스 배출량이 감소할 때까지 매주 교실 파업을 중단하지 않을 것이라고 말한다.	2	썬버그와 그녀가 영감을 준 젊은이들은 기후변화에 책임이 있는 온실가스 배출 감소를 볼 때까지 매주 교실 파업을 멈추지 않을 것이라고 말한다.	2
73	74	In Nigeria's capital Abuja, Oladosu Adenike marked her 46th consecutive strike on Friday.	a	나이지리아의 수도 아부자에서는 올라도수 아데니케가 미래를 위한 금요일 운동을 연속 46주째 이어나가고 있다.	2	나이지리아 수도 아부자에서 올라도스 아데니케가 28일 46연패를 기록했다.	3	나이지리아 수도 아부자에서 올라도수 아데니케는 4일(현지시간) 46번째 연속 파업을 기록했다.	1
74	75	"The activist posted images on Twitter of students dressed in blue school uniforms carrying banners with messages, ""Climate change is real"" and ""We don't have time."""	a	환경 운동가인 아데니케는 “기후 변화는 현실이다” 혹은 “우리는 시간이 없다”라는 메시지를 적은 플래카드를 들고 있는 파란색 교복을 입은 학생들의 사진을 트위터에 게재했다.	1	"이 운동가는 트위터에 ""기후 변화는 현실"" ""우리는 시간이 없다""는 메시지가 적힌 현수막을 들고 있는 푸른 교복을 입은 학생들의 사진을 올렸다."""	1	"이 운동가는 파란 교복을 입은 학생들이 '기후 변화는 현실이다' '시간이 없다'는 글과 함께 현수막을 들고 있는 모습을 트위터에 올렸다."""	1
75	76	In Lausanne, Switzerland, where hundreds of climate strike organizers gathered in August planning for this week's events, thousands of people marched through the city, according to local reports.	a	지역 매체에 따르면, 지난 8월 수백 명의 기후 파업 주최자들이 이번 주에 있던 시위를 계획하기 위해 모였었던 스위스 로잔에서 수천 명이 도심을 행진했다.	2	지난 8월 수백 명의 기후파업 주최자들이 이번 주 행사를 위해 모인 스위스 로잔에서는 수천 명의 사람들이 시내를 행진했다고 현지 보도가 보도했다.	1	현지 보도에 따르면 지난 8월 수백 명의 기후파업 주최자들이 이번 주 행사를 위해 모인 스위스 로잔에서는 수천 명의 사람들이 도시를 행진했다고 한다.	2
76	77	Thousands more were expected to take to the streets of Helsinki, Finland, where local media reported that the city's school would allow students to participate.	a	지역 매체에 따르면, 추가로 수천 명이 핀란드 헬싱키의 거리를 점령할 것이며, 헬싱키 학교에서는 학생들이 시위에 참여하는 것을 허락할 예정이었다.	2	수천 명이 더 핀란드 헬싱키 거리로 이동할 것으로 예상되었는데, 현지 언론은 이 도시의 학교가 학생들의 참여를 허용할 것이라고 보도했다.	1	핀란드 헬싱키에서는 수천 명이 더 거리로 나올 것으로 예상되었으며, 현지 언론들은 헬싱키 학교가 학생들의 참여를 허용할 것이라고 보도했다.	1
77	78	Thunberg, who remains in North America following her visit to the U.N., was scheduled to participate in climate strikes in Montreal, Canada.	a	UN 방문 이후 아직 북미에 있는 툰베리는 캐나다 몬트리올에서 열릴 기후 시위에 참여할 예정이었다.	1	유엔 방문에 이어 북미에 남아 있는 툰버그는 캐나다 몬트리올에서 열리는 기후파업에 참가할 예정이었다.	2	유엔 방문 이후 북미에 머물고 있는 툰버그는 캐나다 몬트리올에서 기후 파업에 참여할 예정이었다.	2
78	79	Meghan to 'fulfil her heart's desires' and refuses let own needs 'fade away' amid her royal duties	b	메건, “내 가슴이 원하는 일 할 것”, 그리고 왕실의 의무 때문에 사적인 의무를 “저버리지” 않을 것	2	메한은 왕실의 의무 속에서 '마음의 욕망을 충족시키고' 자신의 필요를 '사라지게' 하는 것을 거부한다.	1	Meghan은 '마음의 욕망을 충족시키고' 그녀의 왕실 의무 속에서 '사라지는' 욕구를 거부한다.	1
79	80	Meghan Markle is determined to 'fulfil her heart's desires' and not let her own needs 'fade away' now she's a member of the Royal Family - and wants to be a role model for young boys as well as girls.	b	메건 마클은 왕실의 일원이 된 지금 ‘내 가슴이 원하는 일을 할 것’이며 사적인 의무를 ‘저버리지’ 않겠다고 결심했다. 그리고 어린 소년과 소녀들의 롤모델이 되고자 한다.	2	메한 마클은 '마음의 욕망을 충족시키기'로 결심하고 있으며, 이제 그녀는 왕실의 일원이 되었고, 소녀들뿐만 아니라 어린 소년들의 역할 모델이 되기를 원한다.	1	메건 마클은 '마음의 욕망을 충족시키고' 그녀가 왕실 가족이 된 지금 자신의 욕구를 사라지게 하지 않기로 결심했으며, 소녀들뿐만 아니라 어린 소년들의 롤모델이 되고 싶어한다.	2
