	Segment ID	Source Segment	Segment Origin	Ref	Ref_rating	MT_Z	MT_Z_rating	MT_Y	MT_Y_rating
80	81	The Duchess of Sussex, 38, reportedly made the remarks during an event for inspiring female entrepreneurs at Woodstock Exchange in Cape Town earlier this week during her tour of South Africa with husband Prince Harry.	b	서식스 공작 부인인 메건(38)은 이번 주 초 남편 해리 왕자와 함께 남아프리카를 순방하던 중, 케이프타운의 우드스톡 익스체인지에서 열린 영향력 있는 여성 기업가들을 위한 한 행사에서 이와 같이 발언한 것으로 알려졌다.	1	서섹스 공작부인(38)은 이번 주 초 남편 해리 왕자와 함께 남아프리카공화국을 순방하던 중 케이프타운 우드스톡 거래소에서 여성 기업가들에게 영감을 준 행사에서 이같이 말한 것으로 알려졌다.	2	서섹스 공작부인(38)은 이번 주 초 남편 해리 왕자와 남아프리카를 순방하는 동안 케이프타운 우드스탁 거래소에서 열린 여성 사업가들에게 영감을 주기 위한 행사에서 이같이 말한 것으로 알려졌다.	2
81	82	Woodstock Exchange, the UK-SA Tech Hub, focuses on skills development and access to markets by assisting entrepreneurs, particularly women, to acquire skills, resources and support.	b	영국-남아프리카 테크 허브인 우드스톡 익스체인지는 기업가들 중에서도 특히 여성 사업가들에게 필요한 기술, 자원, 후원을 제공해 그들이 기술을 습득하고 시장에 진출할 수 있도록 하는 데 초점을 두고 있다.	2	UK-SA Tech Hub인 Woodstock Exchange는 기업가, 특히 여성이 기술, 자원 및 지원을 획득할 수 있도록 지원함으로써 기술 개발 및 시장 접근에 중점을 둡니다.	1	UK-SA Tech Hub인 Woodstock Exchange는 기업가, 특히 여성이 기술, 자원 및 지원을 획득할 수 있도록 지원함으로써 기술 개발 및 시장 접근에 초점을 맞춥니다.	1
82	83	The Ladies Who Launch meeting saw the former actress, 38, meet with several women who have set up their own businesses in industries such as technology, conservation and fashion and praise them for 'empowering the next generation' of creative minds.	b	더 레이디스 후 런치 모임에서 전직 여배우인 메건(38)은 테크놀로지, 보호, 패션 등의 분야에서 창업한 여러 여성 기업가들을 만나 그들이 “차세대의 창의적인 마인드를 강화시키고 있다”며 찬사를 표했다.	1	‘출발하는 숙녀들’ 모임에서는 전 여배우(38)가 기술, 보존, 패션 등 산업에 자사 사업을 시작한 여러 여성들을 만나 ‘다음 세대를 힘내라’는 창의적인 마음을 칭찬하는 모습을 봤다.	1	론칭한 여주인공 모임에서는 38세의 전 여배우가 기술, 보존, 패션과 같은 산업 분야에서 자신의 사업을 세운 여러 여성들을 만나 '차세대 창의적 마인드에 힘을 실어준다'고 칭찬하는 모습을 볼 수 있었다.	1
83	84	During a conversation with the female tech founders Meghan, who has campaigned vigorously for the empowerment of young women and girls, said she hopes to do the same for young men.	b	젊은 여성과 어린 소녀의 역량 강화를 적극 홍보하고 있는 메건은 여성 테크 기업 대표들과 대화하면서 젊은 남성들을 위해서도 이런 일을 하고 싶다고 말했다.	2	젊은 여성과 소녀들의 힘을 얻기 위해 강력하게 캠페인을 벌여온 여성 기술 설립자 메한과의 대화에서 그녀는 젊은 남성들을 위해 같은 일을 하기를 희망한다고 말했다.	3	젊은 여성들과 소녀들의 힘을 얻기 위해 힘차게 캠페인을 벌여온 여성 기술 창업자 메건과의 대화에서, 그녀는 젊은 남성들에게도 똑같이 하고 싶다고 말했다.	1
84	85	Mother-of-two Naadiya Moosajee, a South African engineer, social entrepreneur and co-founder of Women in Engineering, revealed: 'We acknowledged the importance of not just education for girls but being role models for boys - that we are women who are influential and who boys can look up to as well,' People reports.	b	남아공 출신 공학자이자 기업가이며 위민 인 엔지니어링의 공동설립자인 두 아이의 엄마 나디야 무사지는 다음과 같이 말했다. “우리는 소녀들을 교육시키는 것뿐만 아니라 소년들의 롤모델이 되는 것도 중요하다는 걸 안다. 왜냐하면 우리는 영향력 있는 여성들이고, 소년들이 존경할 수 있는 사람들이기 때문이다.”라고 피플지(People)는 보도했다.	2	남아프리카의 엔지니어, 사회적 기업가, 공학 분야의 공동 설립자인 두 아이의 어머니 나디야 무사지는 '우리는 소녀들을 위한 교육뿐만 아니라 소년들을 위한 역할 모델이 되는 것의 중요성을 인정했다. 우리는 영향력 있고 소년들이 존경할 수 있는 여성이다'라고 사람들은 보고한다.	2	남아프리카의 엔지니어이자 사회적 기업가이자 여성 공학 분야의 공동 설립자인 Naadiya Mosajee는 '우리는 여자아이들을 위한 교육뿐만 아니라 남자아이들을 위한 역할 모델이 되는 것의 중요성을 인정했습니다 - 우리는 영향력 있고 남자아이들도 존경할 수 있는 여자입니다'라고 밝혔다.	1
85	86	'We both have sons, and we were bearing in mind that we are not just role models for girls but boys - and not just our sons, but generally in public too.'	b	“우리에게는 아들도 있다. 그래서 우리는 소녀들뿐 아니라 소년들에게도 본보기가 되어야 한다는 걸 명심하고 있다. 그리고 내 아들뿐 아니라 일반 대중에게도 말이다.”	2	'우리 둘 다 아들이 있고, 우리는 단지 소녀들을 위한 역할 모델일 뿐만 아니라 소년들을 위한 역할 모델일 뿐 아니라, 일반적으로 공공장소에서도 그렇다는 것을 염두에 두고 있었다.'	3	'우리 둘 다 아들이 있고, 우리는 단지 여자아이들뿐만 아니라 남자아이들의 롤모델이라는 것을 염두에 두고 있었다. 그리고 우리 아들들뿐만 아니라 일반 대중들 앞에서도 마찬가지이다.'	1
86	87	She added that having Meghan present 'didn't feel hierarchical', as it was 'women gathered together and a talk about the struggles we have, as well as the things we need to do to move forward and grow and change our societies'.	b	또한 그녀는 메건의 존재가 “위계적으로 느끼지 않았다”, 왜냐하면 여기는 “여성들이 모인 자리이고 우리의 투쟁이나 우리가 앞으로 성장하고 사회를 바꾸기 위해 해야 할 일에 대해 대화하는 자리였기 때문”이라고 덧붙였다.	2	그녀는 메건이 '여성들이 함께 모여 우리가 가진 투쟁과 앞으로 나아가고 성장하고 사회를 변화시키기 위해 우리가 해야 할 일들에 대한 이야기'였기 때문에 '계층적인 느낌을 받지 못했다'고 덧붙였다.	3	그녀는 메건이 참석하는 것이 '여성들이 함께 모여서 우리가 가진 투쟁과 앞으로 나아가고 성장하고 사회를 변화시키기 위해 해야 할 일들에 대해 이야기하는 것'이었기 때문에 '위계적으로 느껴지지 않았다'고 덧붙였다.	1
87	88	Matsi Modise, founder of skills training company Simodisa, said Meghan is determined to continue to champion the issues close to her heart despite being a member of the Fold.	b	기술 교육 기업인 시모디사의 설립자인 마시 모디세는 메건이 왕실의 일원임에도 불구하고 계속해서 이 사안들을 위해 싸우겠다는 의지를 보였다고 말했다.	3	기술 훈련 회사인 시모디사의 설립자인 마시 모디스는 메건이 폴드의 일원임에도 불구하고 가슴에 가까운 문제들을 계속 옹호할 것이라고 말했다.	1	기술 훈련 회사 시모디사의 설립자인 마츠이 모디세는 메건이 폴드의 멤버임에도 불구하고 자신의 마음 속 깊은 곳에 있는 문제들을 계속 옹호할 것이라고 말했다.	2
88	89	'She talked about being a mother and having duties as a duchess and fulfilling what her heart desires - and that it can't just fade away now that you're a duchess,' Modise recalled.	b	“메건은 엄마가 되는 것, 공작 부인으로서의 의무, 자신의 가슴이 원하는 일을 하는 것 등에 대해 말하며, 공작부인이 됐다고 해서 그게 갑자기 사라질 수는 없다고 말했다.”라고 모디세는 회상했다.	3	'그녀는 엄마가 되고 공작부인으로서의 의무를 가지고 그녀의 마음이 원하는 것을 성취하는 것에 대해 이야기했고, 당신이 공작부인이기 때문에 그것이 그냥 사라질 수는 없다고 말했다.'라고 모디스는 회상했다.	2	'그녀는 엄마가 되어 공작부인으로서의 의무를 갖고 그녀의 마음이 원하는 것을 성취하는 것에 대해 이야기했다 - 그리고 당신이 공작 부인이 된 지금 그냥 사라질 수는 없다'고 모디스는 회상했다.	1
89	90	'That you have to be true to who you are.'	b	“자기 자신에게 진실해야 한다고 말했다.”	3	'자신의 모습에 충실해야 한다는 것.'	2	'당신이 누구인지 진실해야 한다'	1
90	91	She said the duchess pushed them to plough ahead with their new ideas and spoke about how they have to keep pushing and going forward, knowing they are doing it for others who will follow.	b	메건 공작 부인은 그들이 새로운 아이디어를 추진하도록 장려했고, 자신을 따르는 이들을 위한 일임을 인지하고 쉬지 않고 계속 전진해야 하는 이유에 대해 말했다고 모디세는 밝혔다.	3	그녀는 공작부인이 새로운 아이디어를 강행하도록 강요했고, 그들이 따라올 다른 사람들을 위해 그것을 하고 있다는 것을 알고 어떻게 계속 밀고 나아가야 하는지에 대해 말했다고 말했다.	1	그녀는 공작부인이 그들의 새로운 아이디어를 밀고 나가게 했으며, 그들이 어떻게 계속 밀고 나아가야 하는지에 대해 이야기했고, 그들이 그것을 따를 다른 사람들을 위해 하고 있다는 것을 알았다고 말했다.	2
91	92	'She wasn't referring to being a royal, but life in general when you have challenges,' Modise added, admitting she felt a bit 'awestruck' by Meghan.	b	모디세는 “메건은 왕족으로서의 삶이 아니라 어려움을 겪는 보통의 삶에 대해 말했다”고 덧붙이며 자신이 메건에게 약간 “압도당했음”을 인정했다.	1	"""그녀는 왕족이 되는 것을 말하는 것이 아니라, 여러분이 도전을 할 때 일반적으로 삶을 말하는 것이었다.""라고 모디스는 메한에게 약간 '엄청난' 느낌을 받았다고 인정하면서 덧붙였다."	1	"모디스는 ""그녀는 왕족인 것이 아니라 도전이 있을 때의 삶을 말하는 것이었다""며 ""그녀는 메건에게 약간 '놀라움'을 느꼈다고 인정했다."	2
92	93	'She radiates grace and she is taking this task that she has with such grace,' Modise said.	b	“메건은 기품이 넘치는 사람이고, 자신이 맡은 이 문제를 임함에 있어 우아함을 잃지 않는다.”고 모디세는 말했다.	1	'그녀는 은총을 발산하고 그녀는 그런 은총으로 가지고 있는 이 일을 하고 있다'고 모디스는 말했다.	2	"""그녀는 우아함을 발산하고 그녀가 가지고 있는 이 일을 아주 우아하게 받아들이고 있습니다.""라고 모디스는 말했다."	3
93	94	A lot of us have done amazing things as founders, but meeting a royal is quite daunting.	b	우리 대부분이 설립자로서 놀라운 일을 많이 했지만, 왕족을 만나는 건 상당히 벅찬 일이다.	1	우리들 중 많은 사람들이 설립자로서 놀라운 일을 해왔지만, 왕실을 만나는 것은 꽤 위압적이다.	3	많은 사람들이 창업자로서 놀라운 일들을 해냈지만, 왕족과 만나는 것은 상당히 힘듭니다.	2
94	95	She made it easy.	b	메건이 수월하게 만들어줬다.	3	그녀는 쉽게 해냈다.	1	그녀는 쉽게 만들었다.	2
95	96	She is an easy-going royal.'	b	그녀는 정말 소박한 왕족이다.”	1	그녀는 쉽게 왕족이다.'	2	그녀는 털털한 왕족입니다.'	1
96	97	Meghan also revealed she's enjoying the pressures of being a working mother, admitting she finds juggling being a royal and looking after baby Archie 'a lot' but 'all so exciting'.	b	메건은 워킹맘에게 오는 압박마저도 즐기고 있다고 밝혔고, 왕족으로서 할일과 어린 아치를 돌보는 일을 동시에 하는 게 “버겁”지만 “둘다 매우 신나는 일”이라고 말했다.	1	메한은 또한 그녀가 일하는 엄마가 되는 압박감을 즐기고 있다고 밝히면서, 그녀가 저글링이 왕족이라는 것을 인정하고 아기 아치를 '많이' 돌보고 있지만, '너무 흥분된다'고 말했다.	2	메건은 또한 자신이 워킹맘이 되어야 한다는 압박감을 즐기고 있다고 밝히면서 저글링이 왕족이고 아기 아치를 '많이' 돌본다는 것을 인정하지만 '모두 너무 흥분된다'고 말했다.	2
97	98	Speaking to mother-of-two Lara Rosmarin, CEO of Cape Innovation and Technology, Meghan said: 'We're only five months in right now.	b	메건은 케이프 이노베이션 앤 테크놀로지의 CEO이자 두 아이의 엄마인 라라 로스마린에게 이렇게 말했다. “우리는 이제 겨우 5개월 됐다.	2	메한은 케이프 혁신 기술 CEO인 두 아이의 엄마 라라 로스마린과의 인터뷰에서 '우리는 지금 5개월밖에 안 남았어.	3	"메건은 케이프 이노베이션 앤드 테크놀로지의 CEO인 라라 로스마린과의 인터뷰에서 ""우리는 지금 겨우 5개월밖에 남지 않았다""고 말했다."	1
98	99	Being a working mum and travelling as well with a baby, my goodness it's a lot, but it's all so exciting.	b	워킹맘이 되고 아기와 돌아다니는 건 세상에나 정말 벅차다, 그러지만 둘다 정말 즐겁다.”	1	일하는 엄마로서 아기와 함께 여행하는 것, 세상에, 정말 많은 일이긴 하지만, 모든 것이 너무 흥미진진해.	2	일하는 엄마로서, 아이와 함께 여행한다는 것, 세상에, 많은 일이지만, 모든 것이 너무 신나요.	2
99	100	"'There are days when it's a lot to juggle but then you meet someone and you have an impact on them and you say ""ah-ha,"" and it's so rewarding.'"	b	“모든 걸 해내는 게 때로는 힘들지만 또 어떤 때에는 우리가 누군가를 만나 그들에게 영향을 주고 그걸 보며 ‘아하’라고 깨닫는다. 참 보람찬 일이다.”	1	"'저글링할 것이 많지만, 그 다음에 누군가를 만나 그들에게 영향을 미치고 ""아하""라고 말하는 날이 있는데, 그것은 매우 보람이 있다.'"	2	'저글링하기 힘든 날도 있지만 누군가를 만나서 영향을 주고 '아하'라고 말하면 보람이 있다'고 했다.	2
100	101	Meghan then went to the city's Mothers2Mothers organisation, which trains and employs women with HIV.	b	그 후 메건은 HIV를 앓고 있는 여성의 교육과 고용을 지원하는 비영리단체인 마더스투마더스 케이프타운을 방문했다.	1	메한은 그 후 HIV를 가진 여성들을 훈련시키고 고용하는 이 도시의 어머니2마더스 조직에 갔다.	2	Meghan은 HIV에 걸린 여성을 훈련시키고 고용하는 Mothers2 Mothers라는 도시에 있는 Mothers2 Mothers 기관으로 갔다.	3
101	102	She took along some of Archie's baby clothes, including a onesie saying 'The Future' and his Invictus babygro which he no longer fits, alongside donations from her friends with children.	b	메건은 아이를 둔 지인들에게 기증 받은 기증품과 함께 ‘더 퓨처(미래)’라고 적힌 원지 한 벌과 인빅투스의 베이비그로 한 벌 등 아치가 커서 못 입는 옷을 가져갔다.	1	그녀는 '미래'라고 쓰인 아치의 아기 옷과 그가 더 이상 맞지 않는 인빅투스 베이비그로를 포함한 아치의 아기 옷 몇 벌을 아이들과 함께 보낸 친구들의 기부와 함께 가져갔다.	2	그녀는 '미래'라는 외투와 더 이상 어울리지 않는 인빅터스 베이비그로 등 아치의 유아복 일부를 가져갔으며, 아치가 아이를 둔 친구들의 기부도 함께 받았다.	1
