	Google Before	Google After	TER
163	나는 그들이 어디로 가는지는 표지의 표지 인 것입니다.	나는 그들이 어디로 가는지는 표지의 표지 인 것입니다.	0.0
164	나는 그것이 슬프다고 생각합니다. 정의 부서가 너무 불량배가되어 있습니다.	나는 그것이 슬프다고 생각합니다. 정의 부서가 너무 불량배가되어 있습니다.	0.0
165	글쎄, 그들은 잠시 동안 왔습니다. 그리고 이제는 사안을 더욱 악화시킵니다.	글쎄, 그들은 잠시 동안 왔습니다. 그리고 이제는 사안을 더욱 악화시킵니다.	0.0
166	펠로시 (Pelosi)는 트럼프가 우크라이나에 군사 원조를 보류 한 후에 공식 탄핵 수사를 발표했다.	펠로시 (Pelosi)는 트럼프가 우크라이나에 군사 원조를 보류 한 후에 공식 탄핵 수사를 발표했다.	0.0
167	이 원조는 궁극적으로 부여되었지만 하우스 민주당은 Zelensky를 5 년 동안 우크라이나 가스 회사에서 일하는 사냥꾼 Biden을 조사하기 위해 Zelensky를 요구하는지 여부를 알고 싶어합니다.	이 원조는 궁극적으로 부여되었지만 하우스 민주당은 Zelensky를 5 년 동안 우크라이나 가스 회사에서 일하는 사냥꾼 Biden을 조사하기 위해 Zelensky를 요구하는지 여부를 알고 싶어합니다.	0.0
168	또한 금요일, 거의 300 명의 전 미국 외교 정책과 국가 안보 공무원이 탄핵 조사를 지원하는 서한에 서명했다.	또한 금요일, 거의 300 명의 전 미국 외교 정책과 국가 안보 공무원이 탄핵 조사를 지원하는 서한에 서명했다.	0.0
169	"연합성은 트럼프의 행동이 ""심오한 국가 안보 문제""를 구성한다고 말했다."	"연합성은 트럼프의 행동이 ""심오한 국가 안보 문제""를 구성한다고 말했다."	0.0
170	"""우리는 필요한 경로를 우리를 시작한 연사 펠로시 (Pelosi)를 포함하여 회원들의 회원들에게 박수를 보냈다."	"""우리는 필요한 경로를 우리를 시작한 연사 펠로시 (Pelosi)를 포함하여 회원들의 회원들에게 박수를 보냈다."	0.0
171	트럼프 대통령은 땅에서 가장 높은 사무실의 권위와 자원을 활용하여 민주적 과정에 추가적인 외국 간섭을 초래 한 것으로 보입니다.	트럼프 대통령은 땅에서 가장 높은 사무실의 권위와 자원을 활용하여 민주적 과정에 추가적인 외국 간섭을 초래 한 것으로 보입니다.	0.0
172	그건 힘의 불확실한 남용을 구성 할 것입니다.	"그것은 힘의 불능의 남용을 구성 할 것입니다. """	0.375
173	"""그것은 또한 미국의 국가 이익과 우리의 가장 가까운 동맹국과 파트너의 사람들을 대통령의 개인적인 정치적 이익을 위해 노력할 것입니다."""	"""그것은 또한 미국의 국가 이익과 우리의 가장 가까운 동맹국과 파트너의 사람들을 대통령의 개인적인 정치적 이익을 위해 노력할 것입니다."""	0.0
174	트럼프는 전화 통화에 부적절한 흥미가 있음을 거부했습니다.	트럼프는 전화 통화에 부적절한 흥미가 있음을 거부했습니다.	0.0
175	"금요일, 그는 신청인을 비난했고 Zelensky와의 전화가 ""완벽한 대화""라고 말했습니다."	"금요일, 그는 신청인을 비난했고 Zelensky와의 전화가 ""완벽한 대화""라고 말했습니다."	0.0
176	"""소위 휘파람 송풍기가 점점 더 많이 들리고 휘파람 송풍기가 전혀 휘젓는 것이 아닙니다.""그는 Tweeted."	"""소위 휘파람 송풍기가 점점 더 많이 들리고 휘파람 송풍기가 전혀 휘젓는 것이 아닙니다.""그는 Tweeted."	0.0
177	또한, 다른 누군가가 없을 수도 있고, 누출이나 스파이가 그 또는 그녀에게 먹이를주지 못했던 모든 간접적 인 정보는 무엇인가?	"""또한 다른 누군가가 없었던 누군가가 없었던 누군가 또는 스파이가 없을 수도있는 모든 간접적 인 정보가 그 또는 그녀에게 먹이를주지 못했습니다."	0.55
178	당파 수술 가능?	"당파인 수술 가능? """	0.5
179	마이크 펜스 부통령은 우크라이나 지도자들과 상호 작용했으며 휘파람 송풍기 불만을 보여줍니다. 이번 달 이전 폴란드에서 Zelensky로 만났습니다.	마이크 펜스 부통령은 우크라이나 지도자들과 상호 작용했으며 휘파람 송풍기 불만을 보여줍니다. 이번 달 이전 폴란드에서 Zelensky로 만났습니다.	0.0
180	그는 Joe Biden이나 Hunter Biden이 논의되지 않았다고 말했습니다.	그는 Joe Biden이나 Hunter Biden이 논의되지 않았다고 말했습니다.	0.0
181	유럽 ​​최고로 선정된 스코틀랜드 학생 3명	유럽 ​​최고의 스코틀랜드 학생들은 유럽 최고의 학생들이었습니다	0.8571
182	던디 대학교(University of Dundee) 학생 3명이 유럽 최고의 졸업생으로 지역 수상자로 선정되었습니다.	3 명의 대학생 학생들은 지역 우승자들이 유럽 최고 졸업생으로 지명되었습니다.	1.0
183	던디 대학교 학생들은 2019년 글로벌 학부 시상식에서 유럽 각 분야의 최고 졸업생으로 선정되었으며, 같은 대학교의 다른 5명의 학생들이 심사위원들의 찬사를 받았습니다.	던디 학생 대학 (University of Dundee) 학생들은 2019 년 글로벌 학부상의 유럽의 각 분야에서 최고 졸업생으로 지명되었으며, 같은 대학교의 5 명의 다른 학생들이 심사 위원이 칭찬을 받았는 것입니다.	0.7143
184	분자 유전학을 졸업한 Scott Sheldrick은 유럽 생명 과학 상을, Chester Cornford는 정신 건강 간호 석사를 공부하여 간호, 조산사 및 연합 의료 상을, Lola Knibb는 시각 예술 상을 받았습니다.	Chester Cornford는 생명 과학을 졸업 한 Scott Sheldrick, Chester Cornford는 MSC 정신 건강 간호학을 연구했으며 Lola Knibb는 Visual Arts Award를 수상 했는 동안 간호, 미드 웨이 및 연합 헬스 케어 상을 수상했습니다.	0.8125
185	세 팀 모두 글로벌 결승에 진출했지만 결승전에서 전 세계 3,500명의 참가자 중 일부와 치열한 경쟁을 펼쳤습니다.	3 명 모두가 글로벌 결승에 이르게했지만, 그들은 전 세계에서 3,500 명의 참가자 중 일부에서 강력한 경쟁으로 최종 경쟁을 잃었습니다.	0.6842
186	University의 교감(교육)인 Blair Grubb 교수는 다음과 같이 말했습니다.	"대학의 Blair Grubb 교수는 ""이 단계에 도착하는 것은""우리 학생들과 졸업생들이 세계 최고 대학의 일부에 참석하는 동료들과 경쟁을 직면했습니다. """	0.8947
187	"""Undergraduate Awards는 전 세계 수천 명의 학생들이 치열한 경쟁을 펼치고 있으며, 이는 우리 학생들의 자질과 그들이 받는 교육을 잘 반영한 것이므로 Dundee는 수상자들 사이에서 매우 강력하게 대표됩니다."	"""학부상은 전 세계의 수천 명의 학생들이 엄청나게 경쟁하며 학생들의 품질과 그들이받는 교육은 던디가 상을 수상자들 사이에서 매우 강하게 대표하는 교육입니다."""	1.0
188	"""나는 이 환상적인 업적에 대해 Scott, Chester, Lola에게 큰 찬사를 보낸 다른 Dundee 대표자들과 함께 따뜻한 축하를 전하고 싶습니다."""	"""나는 스콧, 체스터와 롤라를이 환상적인 성과에 따라 스콧, 체스터와 롤라에게 제공하고, 고도로 헌신 한 다른 던디 대표들과 함께,"""	1.0
189	또 다른 5명의 학생은 세계 최고의 학부 상 프로그램에서 표창을 받았으며, 이 프로그램은 학부생이 이를 전 세계 청중과 공유하기 위해 완료한 최고의 작업을 인정합니다.	또 다른 5 명의 학생들은 학부생이 완성한 최고의 작업을 인정하여 글로벌 청중과 공유하는 최고의 작업을 인정하는 것입니다.	1.1765
190	5명의 칭찬받은 학생에는 Nicholas Gallagher와 James Osbourne(둘 다 생명 과학), Ferenc Kohsuke Ishikawa Gutai(의학), Caitlyn Scott(해부 과학) 및 Waco Yokoyama(철학)가 포함되었습니다.	5 명의 칭찬 학생들이 니콜라스 갤러거와 제임스 오스본 (생명 과학), Ferenc Kohsuke Ishikawa Gutai (의약), Caitlyn Scott (해부학 과학) 및 와코 요코야마 (철학)였습니다.	0.6957
191	이 대회는 또한 최고의 학부 과정을 기념하고 전 세계의 학생과 최근 졸업생 간의 협력을 창출하는 데 도움이 됩니다.	경쟁은 최고 학부 과정을 기념하고 전 세계적으로 학생들과 최근 졸업생 간의 협력을 창출하는 데 도움이됩니다.	0.5333
192	Thomas Cook 연금 수탁자는 지불금을 회수하기 위해 거래를 계획합니다.	Thomas Cook Pensionees Plot Travage Payouts에 대한 플롯	0.875
193	Thomas Cook의 연기금이 무너진 여행 그룹의 퇴직 계획 혜택을 구제하기 위한 거래에 대해 전문 보험사와 협상을 시작했습니다.	Thomas Cook의 연금 기금은 붕괴 된 여행 그룹의 퇴직 계획 혜택을 구제하는 데 거래에 대한 전문 보험사와의 회담을 시작했습니다.	0.4737
194	Sky News는 이사회 의장인 Steve Southern이 Thomas Cook의 14,000명의 연금 계획 회원 대부분이 지불금이 급격히 삭감되는 것을 피할 수 있는 매수 거래에 대해 여러 당사자와 논의하고 있음을 알게 되었습니다.	스카이 뉴스는 스티브 남부의 의장이 Thomas Cook의 14,000 명의 연금 제도 회원들이 가파른 절단에 직면하는 대부분의 Thomas Cook의 14,000 명의 연금 제도를 피할 수있는 사무 아웃 거래에 관한 여러 당사자와 회담을 맺고 있다는 것을 알게되었습니다.	0.8286
195	보험사와의 모든 거래는 연금 제도가 PPF(연금 보호 기금) 구명 보트로 이전되면서 촉발된 10%보다 더 완만한 지불금 삭감을 수반할 것입니다.	보험사와의 모든 거래는 연금 방지 기금 (PPF) 구명정으로 연금 방지 펀드 (PPF) 구명정으로 옮겨지는 10 %보다 훨씬 겸손한 절단을 포함 할 것입니다.	0.7727
196	논의는 매우 초기 단계에 있으며 - 성공하더라도 - Thomas Cook 계획이 PPF의 평가를 통과할 때까지 거래로 이어지지 않을 것입니다.	토론은 매우 예비적인 단계에 있으며, 성공한 경우에도 Thomas Cook Schemes가 PPF의 평가를 통해 이루어질 때까지 거래를 초래할 수 없습니다.	0.6842
197	토마스 쿡 사장, 붕괴 원인 조사에 직면	Thomas Cook 보스가 붕괴 된 것으로 인도하는 것에 대한 조사를 직면합니다.	0.9091
198	그 기간은 최대 2년이 걸릴 수 있으며, 제도가 PPF에 진입하면 약 10,000명의 미래 연금 수급자가 지불금을 10% 삭감하게 될 것입니다.	그 기간은 최대 2 년이 걸릴 수 있으며, 계획이 PPF에 들어가는 경우 대략 10,000 명의 미래의 연금 수급자가 10 %까지 절단됩니다.	0.619
199	"소식통에 따르면 다수의 연금 위험 이전 전문가와 새로운 ""수퍼펀드"" 통합 수단 중 하나 이상이 Thomas Cook의 이사와 거래에 대해 논의 중이라고 합니다."	"소식통은 많은 연금 위험 이체 전문가뿐만 아니라 새로운 ""Superfund""통합 차량 중 적어도 하나가 거래에 관한 Thomas Cook의 관리위원회와의 대화를 겪었습니다."	0.85
200	회원의 혜택을 확보하기 위한 수탁자들의 노력에 대한 소식은 영국에서 가장 오래된 여행사가 무역을 중단하고 국제 송환 프로그램을 촉발하고 수천 명의 실직을 촉발한 지 나흘 만에 나온 것입니다.	수탁자의 혜택을 보장하려는 수탁자의 뉴스는 영국의 가장 오래된 투어 운영자가 거래를 중단하고 국제 송환 프로그램을 촉발시키고 수천의 일자리 손실을 유발 한 후 4 일 후에옵니다.	0.84
201	Thomas Cook의 파산 위기는 이사회 구성원, 정부 장관 및 감사인 모두가 파산하기 몇 달 전에 자신의 행동을 설명하라는 요구에 직면하면서 쓰라린 비난 게임을 촉발했습니다.	토마스 요리사의 파산에 대한 토마스 요리사는 이사회 회원, 정부 장관 및 감사원이 모두 붕괴되기 전 개월 만에 그들의 행동을 설명하기위한 요구에 직면 한 쓴 비난 게임을 촉발 시켰습니다.	0.7143
202	최근 수치에 따르면 회사의 4개 연금 계획은 PPF 기준으로 1억 파운드의 잉여금으로 자금이 충분합니다.	이 회사의 4 개의 연금 제도는 최신 인물에 따라 PPF 기준으로 £ 100m 잉여금을 갖추고 있습니다.	0.875
203	전체적으로 그들은 약 15억 파운드 상당의 자산을 보유하고 있습니다.	집합 적으로, 그들은 £ 1.5 억 파운드의 자산을 개최합니다.	0.8889
204	그러나 지난달 Sky News에서 밝혔듯이 Thomas Cook이 제안한 구제 거래에서 더 나은 조건을 요구하는 수탁자들의 요구는 거래를 성사시키려는 노력을 더욱 복잡하게 만들었습니다.	그러나 지난 달에 스카이 뉴스가 밝혀진 것처럼 Thomas Cook의 제안 된 구조 거래에서 더 나은 조건에 대한 요구 사항은 거래를 통한 거래를 얻으려는 노력에 대한 추가 합병증을 추가했습니다.	0.7857
205	Thomas Cook의 청산은 178년 간의 용제 거래에 종지부를 찍었고, 정부의 파산 서비스, 회계 감시 기관 및 영향력 있는 MP 위원회의 조사가 시작되었습니다.	Thomas Cook의 청산은 178 년의 솔벤트 거래를 끝내고 정부의 파괴 서비스, 회계 워치 독 및 MPS의 영향력위원회의 문의를 촉구합니다.	0.7895
206	장관들은 위기를 해결하기 위해 태스크포스를 설립했으며, 이로 인해 채권자들은 파산 후 자산 매각으로 인한 수익이 거의 발생하지 않았습니다.	장관들은 자산 사후의 자산 판매로부터 빈약 한 채권자가 돌아 오는 채권자가 남아있는 위기를 해결하기 위해 태스크 포스를 설립했습니다.	0.8333
207	현재까지 Thomas Cook의 해외 영국 고객 중 절반 미만이 비행기를 타고 귀국했습니다.	지금까지 Thomas Cook의 해외 영국 고객의 절반이 밖에 없었습니다.	0.8889
208	파산은 Thomas Cook이 2억 파운드의 자금 수요를 줄이도록 대출 기관에 최후의 탄원서를 보낸 지 몇 시간 만에 발생했습니다.	Thomas Cook은 200m 자금 조달 수요를 줄이기 위해 렌더스에게 Lenders를 발행 한 후 그 붕괴가 왔습니다.	1.0
209	Thomas Cook에게 무엇이 그렇게 잘못 되었습니까?	토마스 요리사에게는 그렇게 잘못 되었습니까?	0.6
210	일요일 저녁에 거래 없이 끝난 회담은 반년 동안 15억 파운드의 손실과 거래 악화로 인해 10억 파운드 이상의 새로운 자금을 조달해야 했던 회사에게 미친듯이 마지막 주사위를 던졌습니다.	일요일 저녁에 거래가 없었지 않은 회담은 £ 15 억달의 반파 손실과 거래를 악화시키는 새로운 자금 조달에 1 억 파운드 이상을 추구해야만하는 회사의 광란의 마지막 던지를 대표했습니다.	0.8077
211	Thomas Cook은 1841년에 32세의 캐비닛 제작자이자 전 침례교 목사에 의해 설립되었습니다. 그는 레스터에서 러프버러까지 1실링의 기차 여행을 제공하기 시작했습니다.	Thomas Cook은 1841 년에 Leicester에서 실링을 위해 Loughborough 로의 1 일간의 레일 여행을 제공하기 시작한 32 세의 캐비닛 메이커와 전세 획득자 설교자가 1841 년에 설립되었습니다.	0.88
212	그로부터 3년 전 창립 175주년을 맞이하여 세계 최대의 휴가 회사 중 하나로 성장했습니다.	거기에서 3 년 전에 175 주년을 기념하여 세계 최대의 휴일 회사 중 하나가되었습니다.	0.7692
213	"PPF 대변인은 ""토마스 쿡의 청산과 같은 지급불능 사건이 바로 PPF가 설립된 이유""라고 말했다."	"PPF 대변인은 ""토마스 요리사의 청산과 같은 파산 이벤트가 PPF가 설정된 이유는 정확히 있습니다."""	0.6154
214	"""우리는 확정 급여 연금 제도에 속한 회원들의 재정적 미래를 보호하기 위해 여기에 있으며 우리가 그들을 보호하기 위해 여기 있다는 것을 알고 위안을 받아야 합니다."""	"""우리는 정의 된 혜택 연금 제도에 소속 된 회원들의 금융 선물을 보호하기 위해 여기에 있으며, 우리가 그들을 보호하기 위해 우리가 여기에있는 것을 알고있는 위로를 가져 가야합니다."""	0.5385
215	Thomas Cook의 연금 수탁자 대변인은 금요일에 논평을 거부했습니다.	Thomas Cook의 연금 수탁자를위한 대변인은 금요일에 댓글을 달았습니다.	0.375
216	기후에 대한 행동을 요구하기 위해 행진하는 전 세계 학교 파업	세계 전세계의 학교 스트라이커 기후에 대한 조치를 요구하는 행진	1.0
217	어제 밤 Who STOP 콘서트: 금요일과 일요일은 CANCELED를 보여줍니다.	어젯밤 콘서트를 멈추는 사람 : 금요일과 일요일 쇼가 취소되었습니다.	0.8889
218	록의 전설 The Who가 미국 주요 투어를 하고 있습니다.	록 전설은 누가 주요 미국 여행에 있습니다.	1.0
219	텍사스주 휴스턴에서 로저 달트리는 공연을 반도 채 안 되어 취소해야 했다.	텍사스의 휴스턴에서 Roger Daltrey는 중간보다 적은 콘서트를 끊을 수있었습니다.	1.1111
220	"75세의 그는 실망한 청중에게 ""내가 앞서 있는 동안 그만둬야 한다고 생각합니다.""라고 말했습니다."	"75 세의 노인들은 실망한 관객에게 ""내가 앞으로 나아가는 동안 나는 그만둬야한다고 생각합니다."""	0.8333
221	밴드는 이미 8곡을 연주했지만 언젠가는 다른 공연을 위해 노력하고 돌아올 것을 약속했습니다.	밴드는 이미 8 곡을 수행했지만 미래에 언젠가 다른 쇼 쇼를 위해 노력하고 반환 할 것을 약속했습니다.	0.5625
222	무대에서 모든 것이 어떻게 전개되었는지 비디오를보십시오.	무대에서 어떻게 전개되는지에 대한 비디오를보십시오.	0.8
223	1982년 클래식 트랙 Eminence Front를 연주한 후 Daltrey는 그만뒀습니다.	클래식 1982 년 트랙 프론트를 재생 한 후 Daltrey는 그만 둔다고 불렀습니다.	0.75
224	그는 보컬 문제로 어려움을 겪었고 분명히 외과 의사의 엄격한 지시를 받고 있습니다.	그는 보컬 문제로 고생하고 외과 의사의 엄격한 지침을 받았습니다.	0.6667
225	영국 스타는 군중에게 쇼를 계속할 수 없다고 말했습니다.	영국 스타는 그가 쇼와 함께 갈 수 없었던 군중들에게 말했다 :	0.7273
226	"""내가 당신을 위해 하는 일을 계속 하면 나 자신을 손상시킬 것입니다."	내가 당신을 위해하고있는 일을하려고 노력하고 있다면 나는 자신을 손상시킬 것입니다.	0.7
227	내가 앞서 있는 동안 그만둬야 할 것 같아...	내가 앞으로 내가 그만둬야 할 것 같아.	0.5714
228	"지난번에 한 달 동안 병원에 입원했고 다시는 가지 않을 것입니다. 죄송합니다."""	마지막으로, 나는 한 달 동안 병원에서 끝났고 나는 거기에 다시 가지 않을 것입니다. 죄송합니다.	0.5714
229	Pet Townshend는 청중에게 무슨 일이 일어나고 있는지 설명했습니다.	"Pete Townshend는 청중에게 무슨 일이 일어나고 있는지 설명했습니다. ""그는 더 이상 할 수없는 것처럼 들리며 두려워합니다 ..."""	0.5882
230	밴드는 원래 로저 없이 나머지 세트를 해결하려고 할 것이라고 제안하면서 무대를 떠났습니다.	밴드는 무대를 떠났습니다. 원래는 Roger가없는 세트의 나머지 부분을 운동하려고 노력할 것이라고 제안합니다.	0.6667
231	"그가 돌아왔을 때 Townsend는 ""정말, 정말 죄송합니다."	"그가 돌아 왔을 때, 타운센드는 ""나는 정말로 정말로 미안해."	0.8889
232	로저는 이제 실제로 말을 할 수 없습니다.	"Roger는 실제로 지금 말할 수 없습니다. """	0.7143
233	"""분명 공연 전에 그는 의사를 만났고 이번 투어를 통해 노래를 정말 잘 불렀습니다."	"""분명히 쇼 앞에서, 그는 의사를 보았고, 당신도 알고 있으며, 그는이 투어를 통해 그렇게 훌륭하게 노래하고 있습니다."	0.75
234	무슨 일이 일어나고 있는지 모르겠습니다.	나는 f ***가 무슨 일이 일어나고 있는지 모른다.	0.5
235	그는 그의 게임의 정상에 있었다.	"그는 그의 게임의 맨 위에 왔습니다. """	0.5714
236	"""오늘 밤 이런 일이 일어나서 정말 죄송합니다..."	"""나는 오늘 밤에 너에게 일어난이 일이 정말로 미안해 ..."	0.8889
237	"이것은 로저의 쇼이고 그의 몸 상태가 좋지 않기 때문에 의미가 있는 것을 조합하려고 하는 것은 별로 의미가 없다고 생각합니다."""	"나는 이것이 로저스의 쇼이기 때문에 어떤 의미가 있기 때문에 어떤 의미가 있기 때문에 어떤 의미가 있기 때문에 어떤 의미가 있는지 생각하지 않으며 좋은 모양이 아닙니다. """	0.8846
238	관중들은 74세의 노인이 무슨 일이 있었는지, 그리고 어떻게 밴드가 공연에 대한 그들의 약속을 존중하기 위해 돌아오기를 희망하는지 설명할 때 완전히 지지했습니다.	군중은 완전히지지했고, 74 세의 일이 일어난 일과 밴드가 쇼에 대한 그들의 헌신을 존중하기 위해 어떻게 되돌아 갔는지를 희망하는 것처럼 74 세의 응원했습니다.	0.7273
239	"타운센드가 말했다. ""최대한 빨리 복귀 날짜를 공개할 것입니다."	"타운센드는 말했다; ""우리는 가능한 한 빨리 돌아 오는 날짜를 게시 할 것입니다."	0.75
240	한가지 설명하자면...	한 가지를 설명하겠습니다 ...	1.0
241	우리는 하루만 쉬고 있습니다.	우리는 하루 만에 하루 만 일합니다.	0.8333
242	로저의 성대 외과 의사가 쉬는 날이라고 해서...	"이것은 Roger의 보컬 외과 의사가 하루를 보내고 있다고 주장하기 때문입니다 ... """	0.8333
243	"""장담컨데 우리는 돌아올 것이고 당신의 티켓을 존중할 것입니다."	"""나는 당신에게 우리가 돌아올 것이고 우리는 당신의 티켓을 존중할 것입니다."	0.4
244	"많이 사랑하고 실망시켜드려 죄송하다""고 말했다."	"나는 너를 너무 사랑해. 그리고 너를 실망 시켜서 미안해. """	1.0
245	쇼가 끝난 후 댈러스와 덴버에서 예정된 금요일과 일요일 밤 콘서트는 취소되었습니다.	쇼를 따르면 Dallas와 Denver의 다가오는 금요일과 일요일의 밤 콘서트가 취소되었습니다.	0.8
246	그들의 다음 쇼는 10월 9일 샌프란시스코에서 열립니다.	그들의 다음 쇼는 샌프란시스코에서 10 월 9 일에 있습니다.	0.6667
247	밴드는 2020년 3월 16일 맨체스터에서 영국 투어를 시작합니다.	밴드는 맨체스터 N 3 월 16 일 2020 년 3 월 16 일에 영국 투어를 열 것입니다.	0.8235
248	미국 사망자는 스코틀랜드 금지가 vaping 및 전자 담배 광고에 이어질 수 있습니다.	미국 사망자는 스코틀랜드 금지가 vaping 및 전자 담배 광고에 이어질 수 있습니다.	0.0
249	전자 담배 및 vaping 제품에 대한 광고 금지는 장관이 고려하고 있습니다.	전자 담배 및 vaping 제품에 대한 광고 금지는 장관이 고려하고 있습니다.	0.0
250	"첫 번째 장관은 ""앞으로의 개월""에서 움직임에 대한 상담이 일어날 것이라는 것을 확인했습니다."	"첫 번째 장관은 ""앞으로의 개월""에서 움직임에 대한 상담이 일어날 것이라는 것을 확인했습니다."	0.0
251	"니콜라 철갑 상어론은 증거가 그러한 제품의 판매를 통해 더 많은 움직임을 지원한다면 그녀의 정부는 ""주저하지 않겠다""라고 말합니다."	"니콜라 철갑 상어론은 증거가 그러한 제품의 판매를 통해 더 많은 움직임을 지원한다면 그녀의 정부는 ""주저하지 않겠다""라고 말합니다."	0.0
252	그것은 vaping 관련 질병이 두 명의 삶을 보장했고, 총 사망자를 11로 가져 오는 것이 었습니다.	그것은 vaping 관련 질병이 두 명의 삶을 보장했고, 총 사망자를 11로 가져 오는 것이 었습니다.	0.0
253	일반적으로 니코틴, 물, 용제 및 맛으로 만들어진 믹스를 흡입하는 것이 포함 된 vaping은 흡연에 도움이되는 대안으로 볼 수 있지만 그 안전은 여전히 ​​완전히 알려져 있지 않습니다.	일반적으로 니코틴, 물, 용제 및 맛으로 만들어진 믹스를 흡입하는 것이 포함 된 vaping은 흡연에 도움이되는 대안으로 볼 수 있지만 그 안전은 여전히 ​​완전히 알려져 있지 않습니다.	0.0
254	그러나 미국에서는 흡연 전자 담배 후에 500 명이 넘는 사람들이 신비한 폐 질환으로 아프다고 알려져 있습니다.	그러나 미국에서는 흡연 전자 담배 후에 500 명이 넘는 사람들이 신비한 폐 질환으로 아프다고 알려져 있습니다.	0.0
