	Google Before	Google After	TER
330	젊은 여성과 소녀들의 역량 강화를 위해 적극적으로 캠페인을 벌여온 여성 기술 창업자 메건과의 대화에서 그녀는 젊은 남성들에게도 그렇게 하기를 희망한다고 말했습니다.	젊은 여성과 소녀의 권한 부여를 위해 격렬하게 캠페인 한 여성 기술 창립자 Meghan과 대화하는 동안 젊은이들에게 똑같이하기를 희망한다고 말했습니다.	0.7368
331	남아프리카 공화국의 엔지니어이자 사회적 기업가이자 Women in Engineering의 공동 창립자인 Naadiya Moosajee는 두 아이의 엄마로 다음과 같이 밝혔습니다. 영향력 있고 어떤 소년들도 우러러볼 수 있는지 '피플이 보도합니다.	"남아공 엔지니어, 사회적 기업가 및 엔지니어링 여성의 공동 창업자 인 Mole-of Naadiya Moosajee : ""우리는 소녀를위한 교육뿐만 아니라 소년을위한 역할 모델이되는 것의 중요성을 인정했습니다. 영향력 있고 누가 소년들이 볼 수 있습니다. ""사람들은보고합니다."	0.875
332	'우리 둘 다 아들이 있고 우리는 단지 소녀들의 롤 모델이 아니라 소년들의 롤 모델이라는 것을 염두에 두고 있었습니다. 그리고 우리의 아들들뿐 아니라 일반적으로 대중 앞에서도 마찬가지였습니다.'	"""우리 둘 다 아들이 있고, 우리는 우리가 여자들을위한 역할 모델이 아니라 우리의 아들만이 아니라 일반적으로 대중이 아니라는 것을 염두에두고있었습니다."""	0.8947
333	그녀는 Meghan이 참석하는 것이 '계층적 느낌이 들지 않았다'고 덧붙였습니다. 왜냐하면 '여성들이 모여 우리가 겪고 있는 어려움과 우리 사회를 발전시키고 성장하고 변화시키기 위해 해야 할 일에 대해 이야기하기'였기 때문입니다.	"그녀는 ""계층 적으로 느끼지 못한다""라고 덧붙였다. 그것은 ""우리가 가진 여성들과 우리가 가진 투쟁에 관한 이야기뿐만 아니라 우리의 사회를 앞으로 나아가고 변화시키기 위해해야 ​​할 일이뿐만 아니라""계층 적으로 느끼지 않았다 ""고 덧붙였다."	0.9
334	기술 훈련 회사인 Simmodisa의 설립자인 Matsi Modise는 Meghan이 폴드의 회원임에도 불구하고 그녀의 마음에 가까운 문제를 계속 옹호하기로 결정했다고 말했습니다.	Matsi Modise, Simodisa 기술 훈련 회사의 설립자 인 Meghan은 폴드의 구성원이 되었음에도 불구하고 심장에 가까운 문제를 옹호하기로 결심했습니다.	0.8333
335	'그녀는 어머니가 되고 공작부인으로서 의무를 갖고 마음이 원하는 바를 성취하는 것에 대해 이야기했습니다. 그리고 당신이 공작부인이라는 사실이 이제 사라질 수는 없다고 Modise가 회상했습니다.	"""그녀는 어머니가되고 공작의 임무를 수행하고 그녀의 심장이 욕망하는 것을 성취하는 것에 관한 이야기를 망쳤습니다. 그리고 그냥 퇴색 할 수는 없습니다.""Modise는 Modise를 회상했습니다."	0.8636
336	'자신이 누구인지에 충실해야 한다는 것.'	"""당신은 당신이 누구인지에 사실이어야합니다."""	1.25
337	그녀는 공작 부인이 그들에게 새로운 아이디어를 계속 추진하도록 부추겼고, 그들이 뒤따를 다른 사람들을 위해 그렇게 하고 있다는 것을 알고 계속 추진하고 앞으로 나아가야 하는 방법에 대해 말했습니다.	그녀는 공작원들이 새로운 아이디어를 앞서 쟁점으로 끌려 갔고, 그들이 어떻게 추진하고 앞으로도 계속 나아갈 것인지를 알고, 그들이 따르는 다른 사람들을 위해 그것을 알고있는 것에 관해 이야기했습니다.	0.8462
338	'그녀는 왕족이 되는 것이 아니라 도전이 있을 때의 일반적인 삶을 말하는 것'이라고 Modise가 덧붙였다.	"""그녀는 왕실이라고 말하지 않았지만, 당신이 도전을 가질 때 일반적으로 인생이었습니다.""라는 Modise는 Meghan에 의해 약간 ""awestruck""을 느꼈다."	1.0
339	'그녀는 은총을 발산하며 그녀가 가진 이 임무를 그런 은총으로 수행하고 있습니다.'라고 Modise가 말했습니다.	"""그녀는 은혜를 발산하고 그녀가 그런 은혜를 가지고있는이 일을하고 있습니다.""라고 Modise는 말했습니다."	1.0
340	많은 우리 중 많은 것들이 창시자로서 놀라운 일을 해왔으나 로열 만나는 것은 꽤 까다 롭습니다.	"""많은 우리 중 많은 것들이 창시자로서 놀라운 일을 해왔으나 로열 만나는 것은 꽤 까다 롭습니다."	0.0667
341	그녀는 쉽게 만들었습니다.	그녀는 쉽게 만들었습니다.	0.0
342	그녀는 쉽게 갈 것입니다. '	"그녀는 쉽게 왕실입니다. """	0.75
343	Meghan은 또한 그녀는 일하는 어머니가되는 압력을 즐기고 있습니다. 그녀는 왕실이되고 아기 아치를 많이 돌려 보며 '모든 흥미 진진한'을 찾고 있습니다.	"Meghan은 또한 그녀가 일하는 어머니가되는 압력을 즐기고 있습니다. 그녀는 왕실이되고 아기 아치를 낳는 것처럼 보이는 저글링을 발견하고 아기 archie ""를 많이 찾는다. 그러나""모든 흥미 진진한 ""."	0.5769
344	Meghan은 Cape Innovation 및 Technology의 CEO 인 2 개의 라라 로사린 (Mother-of-Two Mother-of-Two Rora Rosmarin)에 말하기 : '우리는 지금은 5 개월 만에 우리 우린 지금 당장.	"Meghan은 Cape Innovation and Technology의 CEO의 어머니 ~ 2 마리의 라라 로사린 (Mother-of-Three Rosmarin)에 말하기 : ""우리는 지금은 5 개월 만에 있습니다."	0.5909
345	일하는 엄마가되고, 아기와 함께 여행하는 것은 많은 것이 많지만, 그것은 너무 흥미 진진합니다.	"일하는 엄마가되고, 아기와 함께 여행하는 것은 많은 것이 많지만 너무 흥미로운 것입니다. """	0.3846
346	"'저글링에 많이있을 때 며칠이지만, 당신은 누군가를 만나고 당신은 그들에게 영향을 미치고 당신은 ""아 - 하""라고 말하고, 그것은 너무 보람입니다.'"	"""저글링하는 데는 많은 일이 아닐 수도 있습니다. 그러나 당신은 누군가를 만나고 당신이 그들에게 영향을 미치고 당신은""Ah-ha ""라고 말하고, 그렇게 보람입니다."""	0.8
347	Meghan은 HIV를 가진 여성을 훈련시키고 고용하는 도시의 어머니 2mothers 조직에갔습니다.	Meghan은 HIV를 가진 여성을 훈련시키고 고용하는 도시의 어머니 2mothers 조직에갔습니다.	0.0
348	그녀는 '미래'와 그분의 사람들이 더 이상 적합하지 않은 '미래'와 그의 친구들과의 기부와 함께 아이들과 함께 기부를하는 것을 포함하여 아치의 아기 옷을 따라갔습니다.	"그녀는 ""미래""와 그분의 친구들이 아이들과 함께 기부금과 함께 더 이상 적합하지 않은 ""미래""와 그의 비참한 베이비로를 비롯한 아치의 아기 옷을 따라갔습니다."	0.5238
349	SNP는 임시 PM으로 Jeremy Corbyn을 지원할 수 있습니다.	SNP는 임시 PM으로 Jeremy Corbyn을 지원할 수 있습니다.	0.0
350	SNP는 일시적인 BREXIT를 방해하기 위해 일시적인 근거로 jeremy corbyn 설치를 지원할 수 있습니다.	SNP는 일시적인 BREXIT를 방해하기 위해 일시적인 근거로 jeremy corbyn 설치를 지원할 수 있습니다.	0.0
351	MPS와 Downing Street 사이의 긴장감이 심화됨에 따라 Nicola Strulgeon은 일반 선거가 될 때까지 선임 장관으로서의 노동 지도자의 뒤에서 노동자 뒤에있을 수 있습니다.	MPS와 Downing Street 사이의 긴장감이 심화됨에 따라 Nicola Strulgeon은 일반 선거가 될 때까지 선임 장관으로서의 노동 지도자의 뒤에서 노동자 뒤에있을 수 있습니다.	0.0
352	Corbyn은 8 월에 임시 행정 행정을 이끌어 내기 위해 반란군의 역방향 MPS를 반역자로 옮겼지 만, 특히 자유주의 민주당의 지도자 조윈슨 (Jo Swinson)에서 저항으로 만났습니다.	Corbyn은 8 월에 임시 행정 행정을 이끌어 내기 위해 반란군의 역방향 MPS를 반역자로 옮겼지 만, 특히 자유주의 민주당의 지도자 조윈슨 (Jo Swinson)에서 저항으로 만났습니다.	0.0
353	제안서에서, 야당 당사자들은 자신감이 없다면 Boris Johnson을 시도하고 10 월 31 일에 EU에서 충돌하는 것을 방지하기위한 연장을 모색하는 단일 정부를 형성 할 것입니다.	제안서에서, 야당 당사자들은 자신감이 없다면 Boris Johnson을 시도하고 10 월 31 일에 EU에서 충돌하는 것을 방지하기위한 연장을 모색하는 단일 정부를 형성 할 것입니다.	0.0
354	이 계획은 당시 적용 교당 지원을 얻지 못했지만 SNP의 수석 수치는 10 월 19 일 이전에 거래가 없으면 Johnson이 법률을 지연시키는 법을 지연시킬 법을 강요 할 수 있다고 우려하고 있습니다.	이 계획은 당시 적용 교당 지원을 얻지 못했지만 SNP의 수석 수치는 10 월 19 일 이전에 거래가 없으면 Johnson이 법률을 지연시키는 법을 지연시킬 법을 강요 할 수 있다고 우려하고 있습니다.	0.0
355	"SNP 지도자 인 Nicola 철갑 상크리는 씨의 Johnson이 담당자 인 Johnson이 ""끔찍한 생각""이 될 것이라고 떠날 수있는 것처럼 연장을 확보하기 위해 자리 해달라고 제안했습니다."	"SNP 지도자 인 Nicola 철갑 상크리는 씨의 Johnson이 담당자 인 Johnson이 ""끔찍한 생각""이 될 것이라고 떠날 수있는 것처럼 연장을 확보하기 위해 자리 해달라고 제안했습니다."	0.0
356	"Tweet에 응답 노동 지도자 또는 임시 총리를 설치하는 것을 암시하는 것은 이렇게 말했습니다. ""이에 동의하십시오."	"Tweet에 응답 노동 지도자 또는 다른 임시 총리를 설치하는 것을 암시하는 그녀는 ""이에 동의합니다."""	0.3571
357	"""확장을 확보 할 목적을 위해 누군가 주위에 자신감이 없으며, 즉각적인 선거를 즉각적으로 투표하십시오."	"""확장을 확보하고자하는 단독 목적을 위해 누군가 주위에 자신감이 없으며, 즉각적인 선거를 즉각적으로 선출하십시오."""	0.2308
358	"""아무 것도 위험이 없지만 존슨이 게시물에 없거나 거래를 통해 강제로 떠나거나 나쁜 거래가 나에게 끔찍한 생각처럼 보입니다."""	"""아무 것도 위험이 없지만 존슨이 게시물에 없거나 거래를 통해 강제로 떠나거나 나쁜 거래가 나에게 끔찍한 생각처럼 보입니다."""	0.0
359	베테랑 MPS Harriet Hariet Harman과 Ken Clarke는 둘 다 화합성 정부를 이끌 수있는 잠재적 인 수치로 명명되었지만 고위 SNP 소스는 노동자가되어야 만합니다.	베테랑 MPS Harriet Hariet Harman과 Ken Clarke는 둘 다 화합성 정부를 이끌 수있는 잠재적 인 수치로 명명되었지만 고위 SNP 소스는 노동자가되어야 만합니다.	0.0
360	"ITV의 Robert Peston에게 말했다. ""라고 우리는 BREXIT에 지연을 요청할 수 있으므로 새로운 총리를 설치해야한다는 것은 점점 더 분명해서 분명합니다."	"ITV의 Robert Peston에게 말했다. ""라고 우리는 BREXIT에 지연을 요청할 수 있으므로 새로운 총리를 설치해야한다는 것은 점점 더 분명해서 분명합니다."	0.0
361	"""타협안 후보자를 찾으려고 노력하는 것은 특히 우리가 가지고있는 시점에도 너무 복잡합니다."	"""타협안 후보자를 찾으려고 노력하는 것은 특히 우리가 가지고있는 시점에도 너무 복잡합니다."	0.0
362	"사람들이 그것을 좋아하든, 임시 총리는 Corbyn이어야합니다. """	"사람들이 그것을 좋아하든, 임시 총리는 Corbyn이어야합니다. """	0.0
363	"SNP 대변인은 당사국이 없음을 멈추고 ""가능한 한 빨리이 위험하고 민감한 총리""를 제거하기 위해 노력하고 있다고 말했다."	"SNP 대변인은 당사국이 없음을 멈추고 ""가능한 한 빨리이 위험하고 민감한 총리""를 제거하기 위해 노력하고 있다고 말했다."	0.0
364	"대변인은 다음과 같이 말했습니다. ""이제 가능합니다 - 정치적 의지가있을 경우 - 당사자들은 Boris Johnson의 손에 남아 있지 않고 그의 기름을 확보 할 수있는 편지가 남아 있지 않도록하고 있습니다. Benn Act 주위를두고 있지만, 대신 임시 관리인 총리가 대신에 보낼 수있는 선거가 즉시 개최 된 선거와 함께 서신을 보내는 것만뿐입니다."	대변인은 다음과 같이 말했습니다. Benn Act 주위를 얻는 방법은 일시적인 CareTaker 총리가 보낼 수있는 한편으로는 서신을 보내는 것이 필요합니다.	2.0
365	"""우리는 No-Deal Brexit를 중단하고 Boris Johnson을 없애는 목적을 달성하기 위해 모든 옵션에 열려 있습니다."""	"""우리는 No-Deal Brexit를 중단하고 Boris Johnson을 없애는 목적을 달성하기 위해 모든 옵션에 열려 있습니다."""	0.0
366	SNP 지원을 받아 Corbyn 씨에게 칼날 투표로 내려갈 것입니다.	SNP 지원을 받아 Corbyn 씨에게 칼날 투표로 내려갈 것입니다.	0.0
367	10 개의 민주주의 주의자뿐만 아니라 288 개의 토리 MPS가 있으므로, 반대는 34 개의 독립적 인 MPS 중 일부가 보드에 올 것이라고 필요합니다.	10 개의 민주주의 주의자뿐만 아니라 288 개의 토리 MPS가 있으므로, 반대는 34 개의 독립적 인 MPS 중 일부가 보드에 올 것이라고 필요합니다.	0.0
368	"노동은 그 계획이 ""거래를 멈추지 않는 가장 단순하고 가장 민주적 인 방법""이라고 주장했다."	"노동은 그 계획이 ""거래를 멈추지 않는 가장 단순하고 가장 민주적 인 방법""이라고 주장했다."	0.0
369	그러나 자유주의 민주당은 자신의 당사자들로부터 exory mps와 탈북자의 백업이 필요할 때 Corbyn이 집안에서 필요한지지를 얻을 수 없다고 믿습니다.	그러나 자유주의 민주당은 자신의 당사자들로부터 exory mps와 탈북자의 백업이 필요할 때 Corbyn이 집안에서 필요한지지를 얻을 수 없다고 믿습니다.	0.0
370	"앵거스를위한 kirstene 머리카락, 토리 MP는 ""이 보고서는 많은 사람들이 오랫동안 의심되는 것을 확인합니다 - SNP MP는 No10에서 Jeremy Corbyn을 행복하게합니다."	"앵거스를위한 kirstene 머리카락, 토리 MP는 ""이 보고서는 많은 사람들이 오랫동안 의심되는 것을 확인합니다 - SNP MP는 No10에서 Jeremy Corbyn을 행복하게 해줍니다."""	0.0952
371	"""Corbyn의 약한 자세가 Indyref2에 대한 약세가 민족 주의자에게 결정적인 요소임을 의심의 여지가 없습니다."	"""Corbyn의 약한 입장에 대한 Corbyn이 민족 주의자에게 결정적인 요소임을 의심의 여지가 없습니다."""	0.3333
372	"""그는 이미 총리가 될 경우 2014 국민 투표의 재 운영을 위해 문을 열었습니다."	"""그는 총리가된다면 2014 년 국민 투표의 재 운영을 위해 이미 문을 열었습니다."""	0.5
373	"""보수적 인 정부만이 세대 이벤트에서 한 번이 될 것이라는 것에""아니오 ""를 투표 한 사람들을 위해 일어날 것입니다."""	"""보수적 인 정부만이 세대 이벤트에서 한 번이 될 것이라는 것에""아니오 ""를 투표 한 사람들을 위해 일어날 것입니다."""	0.0
374	"헝가리 오후 Orban은 EU 이그제큐티브에 대한 후보자를 방어한다. ""주머니에 솔루션이있다"""	"헝가리 오후 Orban은 EU 이그제큐티브에 대한 후보자를 방어한다. ""주머니에 솔루션이있다"""	0.0
375	"Viktor Orban 총리는 헝가리의 후보자가 거부당한 후에 ""주머니에""솔루션이 있습니다."	"Viktor Orban 총리는 헝가리의 후보자가 거부당한 후에 ""주머니에""솔루션이 있습니다."	0.0
376	EU 수송원 - 루마니아 사회당 정치가 로바나 프로모션 및 EU 확대에 대한 제안 된 위원, Laszlo Trocsanyi의 전 헝가리 법무부 장관은 재무 제표의 불일치로 인해 발생할 수 없기 때문에 확인 청문회가 앞서 나가지 않을 것이라고 말했습니다.	EU 수송원 - 지정, 루마니아 사회주의 정치가 Rovana Plumb 및 EU 확대를위한 제안 된 위원, László Trócsányi의 전 헝가리 법무부 장관은 재무 제표의 불일치로 인해 불일치로 인해 발생할 수 없었습니다.	0.6
377	"""나는 [Trocsanyi]가 유럽위원회의 일원이되는 가장 적합한 후보자 인""이라고 orban이 말했다."	"""나는 [Trócsányi]가 유럽 집행위원회의 회원이되는 가장 적합한 후보자라고 확신합니다.""orban은 말했습니다."	0.8
378	그의 죄는 정부와 나의 이주에서 헝가리를 보호하기 위해서는 정부와 나에게 도움을주었습니다.	그의 죄는 정부와 나의 이주에서 헝가리를 보호하기 위해서는 정부와 나에게 도움을주었습니다.	0.0
379	이 움직임은 Trocsanyi를 제안한 Orban에 대한 당황스럽고, 이주 정책 및 기타 문제에 대한 브뤼셀과의 브뤼셀과 끊임없이 충돌 한 것으로 나타났습니다.	이 움직임은 Trócsányi를 제안한 Orban에 대한 당혹스럽고, 이주 정책 및 기타 문제에 대한 브뤼셀과의 끊임없는 충돌을 해왔습니다.	0.4706
380	검사관의 모든 지역에서 클리블랜드 경찰이 '실패'	검사관의 모든 지역에서 클리블랜드 경찰이 '실패'	0.0
381	"Scandal-Hit Cleveland Police는 검사원이 모든 분야에서 브랜드 ""실패""를위한 첫 번째 힘이되었습니다."	"Scandal-Hit Cleveland Police는 검사원이 모든 분야에서 브랜드 ""실패""를위한 첫 번째 힘이되었습니다."	0.0
382	전반적으로 폐하의 좌우명 및 화재 및 구조 서비스 (HMICFR)의 폐하의 검사관이 부적절하고 3 가지 주요 지역에서는 범죄를 줄이고 사람들을 안전하게 지키고, 효율적으로 운영하고, 공개하는 방식과 공개 방식을 조사했습니다. 그것의 인력.	전반적으로 폐하의 좌우명 및 화재 및 구조 서비스 (HMICFR)의 폐하의 검사관이 부적절하고 3 가지 주요 지역에서는 범죄를 줄이고 사람들을 안전하게 지키고, 효율적으로 운영하고, 공개하는 방식과 공개 방식을 조사했습니다. 그것의 인력.	0.0
383	"이 결과는 강제가 효과적으로 주요 조치와 경찰과 범죄 위원이 국가위원회 이전에 불리우며 ""중요한 개선""을 보장하기위한 계획에 대해 의문을 제기하는 특별한 조치로 효과적으로 뛰어납니다."	"이 결과는 강제가 효과적으로 주요 조치와 경찰과 범죄 위원이 국가위원회 이전에 불리우며 ""중요한 개선""을 보장하기위한 계획에 대해 의문을 제기하는 특별한 조치로 효과적으로 뛰어납니다."	0.0
384	그런 다음 진행 상황이없는 경우 문제를 해결할 수 있습니다.	그런 다음 진행 상황이없는 경우 문제를 해결할 수 있습니다.	0.0
385	스캔들의 끈은 잉글랜드 북동쪽에있는 Hartlepool, Redcar, Cleveland, Stockton 및 Middlesbrough를 덮고있는 힘을 능가했습니다.	스캔들의 끈은 잉글랜드 북동쪽에있는 Hartlepool, Redcar, Cleveland, Stockton 및 Middlesbrough를 덮고있는 힘을 능가했습니다.	0.0
386	그것은 거의 몇 년 동안 6 개의 수석전재를 보았습니다.	그것은 거의 몇 년 동안 6 개의 수석전재를 보았습니다.	0.0
387	전 지속적 인 숀 가격은 2012 년에 총기율을 위해 자루되었다. 7 명의 임원이 언론인들이 불법적으로 모니터링되었고 계급 내에서 인종 주의자들의 오랜 주장이있었습니다.	전 지속적 인 숀 가격은 2012 년에 총기율을 위해 자루되었다. 7 명의 임원이 언론인들이 불법적으로 모니터링되었고 계급 내에서 인종 주의자들의 오랜 주장이있었습니다.	0.0
388	"업무 관행은 최근에 봉사자와 신체 복장 카메라를 공유 해야하는 임원들과 함께 ""상상할 수있는 것처럼 비효율적 인""비효율적 인 것처럼 앙변 조사관에 의해 최근에 기술되었습니다."	"업무 관행은 최근에 봉사자와 신체 복장 카메라를 공유 해야하는 임원들과 함께 ""상상할 수있는 것처럼 비효율적 인""비효율적 인 것처럼 앙변 조사관에 의해 최근에 기술되었습니다."	0.0
389	"Fil Gormley의 HM Inspector는 지난 2 년 동안 ""중요한""열화가있는 ""실패한 힘""이라고 밝혔다."	"Fil Gormley의 HM Inspector는 지난 2 년 동안 ""중요한""열화가있는 ""실패한 힘""이라고 밝혔다."	0.0
390	"티셔스 밸리 시장 벤 주산은 ""마침내 공식 검증""이었던 ""마침내 공식 검증""이라는 ""마침내 공식 검증""이라는 ""최악의 연구 결과""라고 묘사되었으며 본국 사무실은 지금 개입해야했습니다."	"티셔스 밸리 시장 벤 주산은 ""마침내 공식 검증""이었던 ""마침내 공식 검증""이라는 ""마침내 공식 검증""이라는 ""최악의 연구 결과""라고 묘사되었으며 본국 사무실은 지금 개입해야했습니다."	0.0
391	"그는 ""더 이상 분쟁이 아닙니다."	"그는 ""더 이상 분쟁이 아닙니다."	0.0
392	이 보고서에서 흑백으로 설명 된 사실입니다.	"이 보고서에서 흑백으로 설명 된 사실입니다. """	0.1429
393	"""이 발견은 내가 읽은 가장 비참하고 충격적인 것들 중 일부입니다."""	"""이 발견은 내가 읽은 가장 비참하고 충격적인 것들 중 일부입니다."""	0.0
394	클리블랜드는 HMICFRS 검사원이 최근에 검사 한 세대 중 하나이며 모든 분야에서 불충분 한 유일한 평가 된 세력 중 하나입니다.	클리블랜드는 HMICFRS 검사원이 최근에 검사 한 세대 중 하나이며 모든 분야에서 불충분 한 유일한 평가 된 세력 중 하나입니다.	0.0
395	"Gormley는 ""력은 범죄 예방에 적절하게 우선 순위를 부여하지 않습니다."	"Gormley는 ""력은 범죄 예방에 적절하게 우선 순위를 부여하지 않습니다."	0.0
396	전략적 방향이 부족하고, 힘은 예방 작업에 충분한 자원을 할당하지 않습니다 ...	전략적 방향이 부족하고, 힘은 예방 작업에 충분한 자원을 할당하지 않습니다 ...	0.0
397	그것은 아이들을 포함하여 취약한 사람들에게 적절하게 대응하지 못하고 있습니다.	그것은 아이들을 포함하여 취약한 사람들에게 적절하게 대응하지 못하고 있습니다.	0.0
398	"그것은 그들을 보호하고 그들을 위험에 빠뜨릴 수있는 기회가 없습니다. """	"그것은 그들을 보호하고 그들을 위험에 빠뜨릴 수있는 기회가 없습니다. """	0.0
399	"그는 고위 지도자들이 일관되게 ""윤리적 행동""을 보여주지 않으며, ""클리블랜드 내의 고위 지도자들의 수석 지도자들의 부적절한 행동이 힘의 효율성과 효율성에 영향을 미치는 것이 너무 심오합니다."""	"그는 고위 지도자들이 일관되게 ""윤리적 행동""을 보여주지 않으며, ""클리블랜드 내의 고위 지도자들의 수석 지도자들의 부적절한 행동이 힘의 효율성과 효율성에 영향을 미치는 것이 너무 심오합니다."""	0.0
400	"그는 ""공정성과 존경심으로 인력을 지속적으로 취급하지 않으며 효과적으로 인력과 의사 소통을하지 않거나 노동력에 참여하지 않습니다. 그 과정은 공정한 것으로 인식되지 않으며 지원을 충분히 잘 이해하지 못합니다. 그들."""	"그는 ""공정성과 존경심으로 인력을 지속적으로 취급하지 않으며 효과적으로 인력과 의사 소통을하지 않거나 노동력에 참여하지 않습니다. 그 과정은 공정한 것으로 인식되지 않으며 지원을 충분히 잘 이해하지 못합니다. 그들."""	0.0
401	연구 결과에도 불구하고, 힘은 심각하고 조직 된 범죄를 다루는 방식에 대해 적은 양의 칭찬을 받았지만 범죄를 조사하는 방식을 개선해야한다고 들었습니다.	연구 결과에도 불구하고, 힘은 심각하고 조직 된 범죄를 다루는 방식에 대해 적은 양의 칭찬을 받았지만 범죄를 조사하는 방식을 개선해야한다고 들었습니다.	0.0
402	"힘의 경찰과 범죄위원회 배리 콥이스 (Barry Coppinger)는 다음과 같이 말했습니다. ""나는이 보고서의 걱정 내용에 깊이 걱정하고 있습니다."	"포스의 경찰과 범죄위원회 Barry Coppinger : ""나는이 보고서의 걱정 내용에 깊이 걱정하고있다""고 말했다."	0.7692
403	"""힘의 최근 성과는 단순히 충분하지 않습니다."""	"""힘의 최근 성과는 단순히 충분하지 않습니다."""	0.0
